;0;1;2;3;4;5;6;7;8;9;10;11;12;13;14;15;16;17
0;The Birth of a Nation;The Vampires or, The Arch Criminals of Paris;Twilight of a Woman's Soul;A Man There Was;;Suspense.;The Cabbage-Patch Fairy;The Great Train Robbery;Dante's Inferno;A Trip to the Moon;Fantasmagorie;Workers Leaving the Lumière Factory;The Life and Passion of Jesus Christ;Fantasmagorie;Cabiria;The White Slave Trade;The Student of Prague;Shoulder Arms
1;Intolerance: Love's Struggle Throughout the Ages;Fantômas;After Death;Ingeborg Holm;;Where Are My Children?;Falling Leaves;The Squaw Man;Frankenstein;The Impossible Voyage;Gertie the Dinosaur;Roundhay Garden Scene;A Trip to the Moon;The Black Imp;Dante's Inferno;The Abyss;The Golem;National Red Cross Pageant
2;The Musketeers of Pig Alley;Judex;The Dying Swan;The Outlaw and His Wife;;Tarzan of the Apes;Algie, the Miner;Hell's Hinges;The Haunted Castle;Frankenstein;Sallie Gardner at a Gallop;The Sprinkler Sprinkled;The Great Train Robbery;Dream of a Rarebit Fiend;Satan's Rhapsody;Atlantis;I Don't Want to Be a Man;Till I Come Back to You
3;A Corner in Wheat;The Illustrious Madman;A Life for a Life;The Girl from the Marsh Croft;;Hypocrites;The Consequences of Feminism;His Only Son;The Execution of Mary, Queen of Scots;20,000 Leagues Under the Sea;Poor Pierrot;The Arrival of a Train at La Ciotat;Alice in Wonderland;The Witch;The Capture of Roma;The Mysterious X;The Boxing Kangaroo;Cheyenne's Pal
4;The Lonedale Operator;Le Noël du poilu;Children of the Age;Children of the Streets;;The Troubadour's Triumph;The Tango;The Good Bad Man;A Nightmare;The Conquest of the Pole;The Cameraman's Revenge;The Astronomer's Dream;The Man with the Rubber Head;The Electric Hotel;Love Everlasting;Vera;Where Is My Treasure?;A.W.O.L.
5;The Sealed Room;Fantômas contre Fantômas;For Happiness;The Gardener;;Idle Wives;The Malagueña and the Bullfighter;Algie, the Miner;The Golem;The '?' Motorist;At the Dentist;Traffic Crossing Leeds Bridge;The Big Swallow;The Diabolic Tenant;Assunta Spina;A Trip to Mars;The Merry Jail;The Battle of the Somme
6;The Lonely Villa;The Margrave's Daughter;The King of Paris;The Price of Betrayal;;Scandal;The Ocean Waif;The Battle at Elderbush Gulch;Bluebeard;A Trip to Mars;Little Nemo;The Vanishing Lady;The One-Man Band;The Dancing Pig;Dante's Inferno;The Ballet Dancer;Hilde Warren and Death;A Page of Glory
7;The Unchanging Sea;The Agony of Byzantium;Daydreams;Sons of Ingmar;;The People vs. John Doe;Frozen on Love's Trail;The Massacre;The Infernal Cauldron;A Trip to Mars;The House of Ghosts;The Four Troublesome Heads;Life of an American Fireman;The House of Ghosts;Juve contre Fantômas;Manden med Arret;Das Tagebuch des Apothekers Warren;The Little Tin Soldiers
8;Those Awful Hats;The Dwarf;Child of the Big City;Kiss of Death;;Fine Feathers;The Fur Hat;Out West;The Sealed Room;The Mechanical Butcher;Humorous Phases of Funny Faces;Annabelle Serpentine Dance;The Kingdom of the Fairies;Humorous Phases of Funny Faces;Cretinetti re dei ladri;The Disturbed Sentry;Mr. Wu;On the Jump
9;Death's Marathon;The Heart and the Money;Kumiry;The Sea Vultures;;Shoes;Surprise Attack on a House at Daybreak;Exit of Rip and the Dwarf;A Terrible Night;Dr. Jekyll and Mr. Hyde;The Enchanted Drawing;The Haunted Castle;Bluebeard;The Merry Frolics of Satan;La ballata della strega;The Virtuous One;Wintergartenprogramm;The German Retreat and the Battle of Arras
10;Judith of Bethulia;Tih Minh;Nina;Bra flicka reder sig själv;;Even as You and I;The Lure;Bucking Broadway;The Devil in a Convent;The Electric Girl;How a Mosquito Operates;Baby's Meal;The Melomaniac;The Hilarious Posters;Blue Blood;Bokserparodi;Talarso, der Mann mit den grünen Augen;Battle Front in Britain
11;The Country Doctor;The Obsession;Tears;Prästen;;The Dumb Girl of Portici;The Dream Woman;As It Happened;Dr. Jekyll and Mr. Hyde;The Flying Torpedo;The Haunted Hotel;Sallie Gardner at a Gallop;The Infernal Cauldron;The '?' Motorist;Othello;The End of the World;Ahasver, 2. Teil;L'offensive française sur la Somme
12;The Girl and Her Trust;La Souris blanche;Vozmezdiye;Högfjällets dotter;;The Pursuit of Hate;Cook & Rilly's Trained Rooster;Broncho Billy and the Land Grabber;The House of Ghosts;The End of the World;Autour d’une cabine;Demolition of a Wall;Electrocuting an Elephant;The Haunted Hotel;Marc Antony and Cleopatra;King Frederik VIII's Arrival in Berlin;Im Schatten des Glücks;Functional-motor stimulus and paralysis in war participants and their healing through suggestion in hypnosis
13;Hearts of the World;Les deux gosses;Koroleva ekrana;Strejken;;The Flirt;Making an American Citizen;Broncho Billy and the Sheriff;Satan's Rhapsody;The End of the Homunculus;The Sinking of the Lusitania;The Kiss;The Mermaid;The Eclipse: Courtship of the Sun and Moon;Malombra;The Morphine Takers;Auf dornigen Pfaden;Transport of the U.T. Visitors' Christmas Warrior Donations
14;Mr. Jones Has a Card Party;Mais n'te promène donc pas toute nue;Chuzhaya dusha;Therèse;;Saving the Family Name;Faust and Mephistopheles;Broncho Billy's Ward;The Haunted Castle;The Revenge of the Homunculus;L'Homme Machine;Passage of Venus;The Infernal Cakewalk;The Palace of the Arabian Nights;The Last Days of Pompeii;Kampen om Kvinden;Ahasver, 1. Teil;Dík válečného sirotka
15;The New York Hat;Severo Torelli;Lina's Adventure in Sochi;The Ships That Meet;;The Price of a Good Time;The Burglars;A Ranch Widower's Daughters;The Merry Frolics of Satan;Excursion to the Moon;I'm Insured;Poor Pierrot;Joan of Arc;20,000 Leagues Under the Sea;Snowball Fight;En Død i Skønhed;The Great Moment;Women’s Munition Work
16;His Trust;The Letters;Lina under Examination, or the Turbulent Corpse;The Governor's Daughters;;The Merchant of Venice;Spain;His Reformation;After Death;The Artificial Man;Never Again! The Story of a Speeder Cop.;The Execution of Mary, Queen of Scots;Going to Bed Under Difficulties;The Red Spectre;Pedestrian Love;Den hvide Dame;Stuart Webbs: The Man in the Cellar;Jeunes filles d'hier et d'aujourd'hui
17;The Battle at Elderbush Gulch;In the Bushes;The Seducer;Guilt Redeemed;;The Hand That Rocks the Cradle;At the Floral Ball;Broncho Billy and the Settler's Daughter;The Merry Skeleton;The Madness of Dr. Tube;"The Jealous Doll; or, The Frustrated Elopement";The Cabbage-Patch Fairy;Grandma's Reading Glass;Rescued by Rover;Nero, or The Fall of Rome;Thru Trials to Victory;The Eyes of the Mummy;Pour le pays
18;The Painted Lady;The Open Eyes;The Pearl Necklace;Judge Not;;The Jew's Christmas;The Adventurer;A Close Call;The Monster;That Fatal Sneeze;Lightning Sketches;Dickson Experimental Sound Film;The Terrible Eruption of Mount Pelee and Destruction of St. Pierre, Martinique;The Thieving Hand;Dall'amore al disonore;Peace on Earth;The End of the Homunculus;Le passeur de l'Yser
19;The Mothering Heart;La vengeance du sergent de la ville;Only Once a Year;The Miracle;;The Twins;The Cabbage-Patch Fairy;Frozen on Love's Trail;The X-Ray Fiend;The Love Tragedy of the Homunculus;The Grasshopper and the Ant;A Nightmare;The Sick Kitten;The Story of the Kelly Gang;The Dread of Doom;Temptations of a Great City;The Revenge of the Homunculus;The Intrigue
20;The Massacre;The Roman Orgy;Cold Showers;The Voice of Passion;;For Husbands Only;Clown, Dog and Balloon;At the End of the Trail;The Treasures of Satan;The Airship Destroyer;The Magic Rosette;Monkeyshines, No. 1;The Enchanted Drawing;The Capture of Roma;L'ira;My Sister-in-Law from America;Fear;Les fiancés de 1914
21;Hoodoo Ann;Tragic Error;The Alarm;;;Fate;Le cireur distrait;The Tornado;The Devil and the Statue;Long Distance Wireless Photography;Matsumoto Fragment;The Photographical Congress Arrives in Lyon;The Countryman and the Cinematograph;The Living Playing Cards;The Legend of Saint Barbara;Paradise for the Lazy;Weine nicht, Mutter;Marraines de France
22;The Black Viper;Onesime, Clockmaker;Nelly Raintseva;;;Betty in Search of a Thrill;A Sticky Woman;The Aryan;Dr. Jekyll and Mr. Hyde;Onesime, Clockmaker;The Lily of Belgium;Edison Kinetoscopic Record of a Sneeze;The Fat and Lean Wrestling Match;Kiri-Kis;Julius Caesar;A Deal with the Devil;Zapata's Gang;Belgian Campaigns in Africa
23;The Indian Runner's Romance;S'affranchir - I - La conquête du bonheur;First Love;;;It's No Laughing Matter;A House Divided;White Fawn's Devotion: A Play Acted by a Tribe of Red Indians in America;The Avenging Conscience;Der Weltspiegel;Dreams of Toyland;Man Walking Around a Corner;The Monster;Ben Hur;The Last Days of Pompeii;Det gamle Købmandshjem;Die Abenteuer des Kapitän Hansen;La reéducation professionnelle des mutilées de la guerre en France
24;An Unseen Enemy;Le vainqueur de la course pédestre;Zagadochnyy mir;;;Captain Courtesy;Playing Trumps;The Bronze Bride;The Hallucinated Alchemist;The Automatic Motorist;Clown and His Dogs;The Conjurer;What Happened on Twenty-Third Street, New York City;The Consequences of Feminism;Jenny;Den lille Virtuos;Das Tor der Freiheit;Umanità
25;The Adventures of Dollie;The Nativity;Wicked Night;;;A Heroine of '76;The Coming of Sunbeam;Broncho Billy and the Western Girls;Hilde Warren and Death;The Secret Room;The Musician Monkey;Blacksmith Scene;Explosion of a Motor Car;The Assassination of the Duke de Guise;Pinocchio;Mr. Fabian is Rathunting;Der Schirm mit dem Schwan;Michel and Viktoria
26;The Avenging Conscience;Heart of Hearts;Life in Death;;;The Spider and Her Web;The Irresistible Piano;Madame Bo-Peep;The Spider and the Butterfly;Das andere Ich;Bewitched Matches;After the Ball;Let Me Dream Again;The Black Viper;The Clemenceau Affair;The Golden Horns;Seine Vergangenheit;Our Homeland's Trenches
27;The Burglar’s Dilemma;Tih-Minh: Mysteries of the Circe Villa;The Moon Beauty;;;A Cigarette - That's All;Midwife to the Upper Class;Whispering Smith;La ballata della strega;Clash of the Titans;He Never Objects to Noise;Boat Leaving the Port;History of a Crime;The Adventures of Dollie;Maciste la terreur des bandits;A Lively Dream;Dr. Schotte;Rentier Kulicke's Flug zur Front
28;In the Border States;Thaïs;Her Heroic Feat;;;False Colors;The Birth, the Life and the Death of Christ;By the Sun's Rays;Malombra;The Inventor Crazybrains and His Wonderful Airship;Bobby Bumps' Amusement Park;Dickson Greeting;Uncle Tom's Cabin;The Policemen's Little Run;The Warrior;The Strongest;Erblich belastet?;Hänschens Soldaten
29;The Life of General Villa;Les millions de la bonne;Leon Drey;;;Eyes That See Not;At the Hypnotist's;Straight Shooting;The End of the Homunculus;Alraune;He Was Not Ill, Only Unhappy;Annabelle Butterfly Dance;The Gay Shoe Clerk;New York Subway;Nero and Agrippina;Blind Justice;Shoe Palace Pinkus;War As It Really Is
30;The House of Darkness;The Seneschal's Diamond;Song of Triumphant Love;;;Borrowed Clothes;Alice Guy Films a 'Phonoscène' in the Studio at Buttes-Chaumont, Paris;Play Straight or Fight;The Revenge of the Homunculus;Life Without Soul;He Wants What He Wants When He Wants It;Horse Trick Riders;The Wonderful Living Fan;The Tango;La Moglie di Claudio;A Victim of the Mormons;The Artificial Man;The Battle of the Ancre and Advance of the Tanks
31;The Old Actor;The Exodus;Glory to Us, Death to the Enemy;;;The Doctor and the Woman;Serpentine Dance by Lina Esbrard;The Naming of the Rawhide Queen;Fear;Turn-of-the-Century Surgery;The Puppet's Nightmare;Accordion Player;A Chess Dispute;The Golden Beetle;L'Odissea;Lion Hunting;The Eskimo Baby;Nurse and Martyr
32;The Miser's Heart;The Seven Deadly Sins;The Happiness of Eternal Night;;;John Needham's Double;Matrimony's Speed Limit;The Deputy and the Girl;The Dream Woman;The Black Box;Matches: An Appeal;Snowball Fight;The Magic Book;Tunneling the English Channel;The War and the Dream of Momi;The Grass Widower;The Jolly Vagabonds;Outposts of Empire
33;A Trap for Santa Claus;Triple entente;A Revolutionary;;;Jewel;Wonderful Absinthe;A Westerner's Way;A Cry in the Night;A Trip to Jupiter;A.W.O.L.;The Sea;The Enchanted Well;Rescued from an Eagle's Nest;The Fall of Troy;The Indian Idol;Ringkämpfer;Pershing's Crusaders
34;Lucky Jim;Bout-de-Zan's Money-Box;The 1002nd Ruse;;;Hop - The Devil's Brew;Pierrette's Escapades;The Flower of the Ranch;The Haunted Curiosity Shop;Pirates of 1920;The Faithful Furniture;Playing Cards;The Treasures of Satan;The Spider and the Butterfly;Royal Tiger;Kong Haakons og Dronning Mauds Besøg i Danmark;Life Upon Life;The Unbeliever
35;The Female of the Species;Herr Doktor;Uncle's Apartment;;;The Mysterious Mrs. M;A Story Well Spun;Western Stage Coach Hold Up;Faust and Mephistopheles;Rescued in Mid-Air;The Dinosaur and the Missing Link: A Prehistoric Tragedy;A Terrible Night;Apparitions;The Scheming Gambler's Paradise;The Fire;A Homeless Bird;The Secret of the American Docks;100% American
36;The Face at the Window;Molière;Silent Witnesses;;;The Eye of God;The Dirigible 'Homeland';Men of the Desert;The Artificial Man;Police in the Year 2000;The War and the Dream of Momi;The Boxing Cats;As Seen Through a Telescope;The Malagueña and the Bullfighter;The Faun;Manicuredamen med det store Hjærte;Adamant's Last Race;In the Hands of the Enemy
37;The Greaser's Gauntlet;A Very Fine Lady;;;;Wanted- A Home;The O'Mers in 'The Bricklayers';The Telltale Knife;The Knight of the Snow;Ein neuer Erwerbszweig;Krazy Kat, Bugologist;Newark Athlete;Fire!;Guzmán the Good;Ashes;Digteren og basunblæseren;The Tenor, Inc.;
38;The Battle of the Sexes;A Four-Year-Old Heroine;;;;Sunshine Molly;Bathing in a Stream;Harold's Bad Man;Cleopatra's Tomb;Un viaggio in una stella;The Insects' Christmas;Falling Cat;The Devil and the Statue;The Counterfeiters;Home, Sweet Home;The Henpecked Husband’s Birthday;Ordinary Folk Life in Vienna;
39;Home Folks;Spring: Episode 2 - On the Ponds / The Love Conductor;;;;Lost by a Hair;Guillaume Tell;In the Days of the Thundering Herd;How It Feels to Be Run Over;Der Herr der Welt;R.F.D. 10,000 B.C.;Serpentine Dance;The Prince of Magicians;The Greaser's Gauntlet;Finally Alone!;Elves' Hill;Mene Tekel;
40;Lena and the Geese;Lagourdette, gentleman cambrioleur;;;;From Death to Life;Miss Dundee and Her Performing Dogs;Fatherhood;The Ghost Breaker;Homunkulieschen;Miniature Theatre;Monkeyshines, No. 2;Gulliver's Travels Among the Lilliputians and the Giants;Infantry and Cavalcade on the Occasion of the Young Turks;Wicked Enchantment;Midnatssjælen;Ein Ausgestoßener: 1. Teil;
41;Oh, Uncle!;Spring: Episode 1 - The Awakening of the Source / The Awakening of Nests;;;;The Picture of Dorian Gray;Fra Diavolo;The Conqueror;The Mysteries of Myra;Alraune and the Golem;Los que ligan;Sandow;Uncle Josh at the Moving Picture Show;A Visit to the Seaside;Satan;Through the Enemy's Lines;The Sky Monster;
42;The Peachbasket Hat;Custody of the Child;;;;On the Brink;The Empress;Where the Trail Divides;Sleepy Hollow;Lilith und Ly;La Nageuse;The Devil in a Convent;The Brahmin and the Butterfly;A Smoked Husband;If One Could See Into the Future;The Dangerous Age;Die Ratte;
43;A Smoked Husband;The Cleaning Man;;;;The Price;Mixed Pets;The Mormon;The Missing Bride;Marriage a la Carte;Le Jongleur;The Magician;A Fantastical Meal;Where the Breakers Roar;Lucrezia Borgia;Millionærdrengen;Das Opfer der Yella Rogesius;
44;Where the Breakers Roar;Bout-de-Zan et le cheminot;;;;The Rosary;My Madonna;'49–'17;The Love Tragedy of the Homunculus;Die Eisbraut;Bobby Bumps Helps Out a Book Agent;Cordeliers' Square in Lyon;The Magic Lantern;Avventura galante di un provinciale;Il re, le torri e gli alfieri;The Girl Behind the Counter;Gypsy Blood;
45;The Son's Return;For the Children;;;;Discontent;The Girl in the Arm-Chair;The Half-Breed;Portrait;Homunculus;Bobby Bumps at Fido's Birthday Party;Buffalo Running;How He Missed His Train;Marvellous Reversing;The Bells of Death;Hvor Sorgerne glemmes;Comic Encounter in the Djurgården;
46;Double Trouble;Bébé Corrects His Father;;;;A Japanese Idyll;An Obstacle Course;The Return of Draw Egan;The Mysterious Retort;The Intrigue;Bobby Bumps Adopts a Turtle;The Bewitched Inn;Ten Ladies in an Umbrella;Bokserparodi;Tweedledum as Aviator;The House of Ill Repute;At the Photographer's;
47;The Escape;Bout-de-Zan and the Crocodile;;;;How Men Propose;Serpentine Dance by Mme. Bob Walter;Thieves' Gold;Faust and Marguerite;De mystiske Z-Straaler;The Waiter's Dream;Santa Claus;A Storm at Sea;Dream of the Moon;Carnevalesca;Dr. Jekyll and Mr. Hyde;Akrobatisches Potpourri;
48;Betsy's Burglar;Le gendarme est sans culotte;;;;;"Polin Performs ""The Anatomy of a Draftee""";Broken Ways;Maple Leaf Viewing;Das lebende Rätsel;He Only Wanted to Play with Dodo;Carmencita;A Spiritualist Photographer;Deadly Idyll;Agrippina;The Pride of the Circus;The Love Tragedy of the Homunculus;
49;The Way of Man;The Vipers;;;;;Automated Hat-Maker and Sausage-Grinder;The Last Drop of Water;The Man with Wax Faces;Deadly Gas;Tarou no Banpei - Senkoutei no Maki;The Pillar of Fire;Extraordinary Illusions;Pharmaceutical Hallucinations;The Slave of Carthage;The Witch and the Cyclist;The Hound of the Baskervilles;
50;The Lesser Evil;The Fairy of the Surf;;;;;A Fool and His Money;The Kid Sheriff;The Queen of Spades;William Voss;The Chinese Shadows;Fishing for Goldfish;An Extraordinary Cab Accident;Prussian Culture;Addio giovinezza!;The Black Dream;Carmen;
51;I Did It;La cassette de l'émigrée;;;;;A Four-Year-Old Heroine;A Modern Musketeer;The Cavalier's Dream;The Tunnel;Bobby Bumps Starts for School;The Haunted Castle;The Christmas Dream;The King and the Jester;Thaïs;Crossed Swords;Eine Nacht in der Stahlkammer;
52;The Failure;Tih-Minh: At the Asylum;;;;;The Turn-of-the-Century Blind Man;The Ruse;Satan;The Bodybuilder;Les clowns Price;The Blacksmiths;The Doctor and the Monkey;Sightseeing Through Whisky;Leone XIII;In the Hands of Imposters;The Right To Exist;
53;The Cricket on the Hearth;Tih-Minh: The Man in the Trunk;;;;;At the Photographer's;Buckshot John;The Queen of Spades;Die große Wette;The Little Soldier Who Became a God;The Merry Skeleton;Scarlet Macaw on Perch;The Rivals;The Lady of the Camellias;The Four Devils;Mit Herz und Hand fürs Vaterland;
54;As It Is in Life;Tih-Minh: Two Dramatic Events During the Night;;;;;The Glue;Method in His Madness;Uncle Josh in a Spooky Hotel;Die Entdeckung Deutschlands durch die Marsbewohner;Fancy Matches;Panorama du grand Canal pris d'un bateau;The Marvelous Hen;A Desperate Crime;Parsifal;Gorki, The Demon Detective;Der Weltspiegel;
55;Edgar Allan Poe;Tih-Minh: The Potion of Forgetfulness;;;;;Canned Harmony;Sokové;The Haunted Castle;The Aerial Anarchists;The Dull Sword;Autour d’une cabine;Bob Kick, the Mischievous Kid;Airy Fairy Lillian Tries on Her New Corsets;Il piccolo garibaldino;Ablaze on the Ocean;Agnes Arnau und ihre drei Freier;
56;A Cry for Help;Le portrait de Mireille;;;;;Dranem Performs The True Jiu-Jitsu;Life on the Border;The Skull;Grandfather's Pills;Skeleton of Horse;The Temptation of St. Anthony;Torpedo Flotilla Visit to Manchester;The Fur Hat;The Romance of a Jockey;Opiumsdrømmen;The Ideal Wife;
57;The Way of the World;S'affranchir - III - En garnison;;;;;La cène;The Colonel's Escape;Mortmain;The Invisible Fluid;Le premier cigare;Athlete Swinging a Pick;The Clown and the Alchemist;Satan in Prison;The Merchant of Venice;The Lost Bride;Der Jongleur;
58;Gold Is Not All;S'affranchir - II - Sous le ciel d'Italie;;;;;The Race for the Sausage;Strongheart;The Brand of Satan;America to Europe in an Airship;The Sorcerer's Scissors;Souvenir Strip of the Edison Kinetoscope;Eiffel Tower from Trocadero Palace;Haunted Kitchen;Il cadavere scomparso;Her Son;Apotheose;
59;The One She Loved;Le Pont sur l'abîme;;;;;The Pit and the Pendulum;Hell Bent;Black Orchids;The Mummy;He Poses for His Portrait;Partie d'écarté;Naval Sham Battle at Newport;L'apprenti architecte;Il circolo nero;The Lady with the Camellias;Dresden, August-Brücke;
60;Money Mad;Les Braves Gens;;;;;The Magician's Alms;The Man from Tia Juana;The Picture of Dorian Gray;Love and Science;Oh'phelia: A Cartoon Burlesque;Bedtime for the Bride;Chaise en bascule;Epileptic Seizure, No. 3;Tweedledum's Itching Powder;Lay Down Your Arms!;Countess Kitchenmaid;
61;Enoch Arden;Tant que vous serez heureux;;;;;Turn-of-the-Century Surgery;Broncho Billy's Word of Honor;Dr. Jekyll and Mr. Hyde;Auch Faulheit kann von Nutzen sein;Un rêve au coin du feu;Between Calais and Dover;What Happened in the Tunnel;King Frederik VIII's Arrival in Berlin;Lost in the Dark;Lydia;Frontstairs and Backstairs;
62;The School Teacher and the Waif;Le Chef-lieu de canton;;;;;The Hater of Women;Gentleman Joe;The Devil's Signature;A léleklátó sugár;Cartoons in the Country;The Surrender of Tournavos;Jupiter's Thunderballs;Kong Haakon og Dronning Mauds Indtog i Trondhjem;The Charm of Violence;The Flight from the Seraglio;Die Sündenkette;
63;The Half-Breed;Le poison;;;;;The Cleaning Man;Jealousy on the Ranch;In the Bogie Man's Cave;The Comet's Come-Back;Art's Infancy;Men Boxing;Burning of Durland's Riding Academy;Justinian's Human Torches;Nanà;Money;Wo die Lerche singt;
64;The Voice of the Violin;Le Bas de laine;;;;;"Félix Mayol Performs ""The Trottins' Polka""";Broncho Billy, Outlaw;The Grey Dame;In the Year 2014;Petit Faust;Adventures of William Tell;Photographing a Country Couple;Excursion to the Moon;Buon anno!;A Bride of Death;Arme Maria;
65;The Eternal Mother;A General Strike;;;;;How Monsieur Takes His Bath;Broncho Billy's Sermon;Alraune;The Man Monkey;The Automatic Moving Company;Panorama from Top of a Moving Train;High Diving Scene;Rip's Dream;Mariute;The Black Chancellor;Flottenmarsch;
66;The Usurer;A Village King Lear;;;;;Madame's Cravings;Broncho Billy's Grit;The Pit and the Pendulum;L'hôtel du silence;He Ruins His Family's Reputation;Annie Oakley;Trapeze Disrobing Act;De nieuwe loopjongen uit Breda;Hamlet;The Love Potion;Die Hochzeit im Excentricclub;
67;Broken Ways;Le Mariage de l'aînée;;;;;Starting Something;A Western Legacy;The Devil's Laboratory;The Aerial Submarine;Bébé's Masterpieces;The X-Ray Fiend;Cunard Vessel at Liverpool;"Liquid Electricity; or The Inventor's Galvanic Fluid";On the Roof of the World: The Journey of H.R.H. the Duke of Abruzzo to Karakorum;Christian IXS bisættelse;Die Nonne und der Harlekin;
68;When Knights Were Bold;Bébé juge;;;;;L'utilité des rayons x;A Western Kimona;Life Without Soul;Balaoo the Demon Baboon;Charlie's White Elephant;Sioux Ghost Dance;The Biter Bit;Les petits vagabonds;A Sicilian Heroine;The Adventures of Gar El Hama;Der eiserne Wille;
69;The Last Drop of Water;Orpheline !;;;;;Burstup Homes' Murder Case;The Indian Maiden's Lesson;Turn-of-the-Century Surgery;The Magnetized Man;Modern Sculptors;"Divers at Work on the Wreck of the ""Maine""";Pan-American Exposition by Night;Ein Walzertraum - O Du lieber, o Du g'scheiter, o Du ganz getrauter Fratz;La Gemma di Sant'Eremo;Den sorte Domino;Ihr großes Geheimnis;
70;The Welcome Burglar;Spring;;;;;The Rolling Bed;The Bad Man's Downfall;Il cadavere scomparso;Voyage autour d'une étoile;Business Must Not Interfere;The Kiss;The Bachelor's Paradise;Salome (The Dance of Seven Veils);Beyond Life, Beyond Death;The Will;Nachtschatten;
71;The Inner Circle;Bébé veut payer ses dettes;;;;;Cake-walk nègre;The Millionaire and the Ranch Girl;The Picture of Dorian Grey;La poupée: Le curé et les mannequins;The Portrait of Captain Grogg;Monkeyshines, No. 3;Eight Girls in a Barrel;Die Dollar-Prinzessin;Le faux magistrat;Sherlock Holmes;Die Sieger;
72;The Slave;Bébé, victime d'une erreur judiciaire;;;;;The Landlady;Broncho Billy's First Arrest;Legend of a Ghost;The Vacuum Cleaner;Les Papillons;London's Trafalgar Square;Addition and Subtraction;Marvelous Beehive;Fantômas contre Fantômas;Valdemars sejr;Maskierte Liebe;
73;Sweet and Twenty;Course de taureaux à Nîmes;;;;;Parson Sue;Sentimental Sophie;Faust : apparition de Méphistophélès;She;The Little Tin Soldiers;Leaving Jerusalem by Railway;Native Women Coaling a Ship at St. Thomas, D.W.I.;Cook & Rilly's Trained Rooster;Le mort qui tue;Trolovelsesringen;Comedians;
74;Enoch Arden;La porteuse de pain;;;;;Danse Fleur de Lotus;The Dead Line;The Phantom of the Opera;The Extraordinary Adventures of Saturnino Farandola;Momotaro;Jumping the Blanket;Around the Flip-Flap Railroad;Three American Beauties;Un viaggio in una stella;Nordisk Films Kompagnis studier;Die badende Nymphe;
75;1776, or The Hessian Renegades;Le bon écraseur;;;;;"Félix Mayol Performs ""White Lilacs""";The Man from the East;Dr. Jekyll and Mr. Hyde;"The Twentieth Century Tramp; or, Happy Hooligan and His Airship";The Love Affair of Ima Knut;Buffalo Dance;General Mitre's Visit to the National Museum;Money Mad;Passione tsigana;The Aviator's Generosity;Der Flachs und seine Veredelung;
76;A Chance Deception;Mireille;;;;;Saharet Performs the Bolero;Fame and Fortune;The Troublesome Fly;An Over-Incubated Baby;Bobby Bumps and the Stork;New York, descente des voyageurs du pont de Brooklyn;Attack on a China Mission;Lightning Sketches;Bizzarrie di una ruota;De dumme Mandfolk;Lepain Part 1: The King of the Innocents;
77;His Last Dollar;Tartarin de Toulouse;;;;;A Priest's Conscience;The Patriot;Chinese Magic;A Trip to the Moon;The Ghost of Slumber Mountain;The Mechanical Butcher;Demolishing and Building Up the Star Theatre;Matsumoto Fragment;Sotto l'ala della morte;Gæstespillet;Das andere Ich;
78;The Left-Handed Man;Un coup de vent;;;;;The Tigress;Nobody's Wife;Faust and Mephistopheles;Conquering the Skies;Throwing the Bull;Pompiers : attaque du feu;Chasles;L'Assommoir;Il mio cadavere;The Night Before Christian's Birthday;Vienna in War;
79;The Two Paths;Baby Fisherman;;;;;Faust;The Quakeress;The Coroner's Mistake;Alive 2007;Romeo and Juliet;Childish Quarrel;Sherlock Holmes Baffled;The Last Days of Pompeii;Maciste the Sleepwalker;Hittebarnet;The Firm Gets Married;
