443;;;;;;;;Broncho Billy's Mexican Wife;;;;Dreyfus Court Martial - Arrest Of Dreyfus;The Flying Train;Jamestown Exposition International Naval Review, Hampton Roads, Virginia;;;Vater wider Willen;
444;;;;;;;;Broncho Billy's Heart;;;;Venise, arrivée en gondole;St. John's Guild. Crippled Children to and from Wagon;The Mission;;;Die Liebe der Bajadere;
445;;;;;;;;Alkali Ike's Close Shave;;;;Disques;Laborers in Victorian England;Shot for Looting;;;Beach Rats;
446;;;;;;;;An Indian's Friendship;;;;Cracovienne;Le Cake-Walk: Final;Vanderbilt Cup 1906;;;Durchkreuzte Pläne;
447;;;;;;;;The Ranch Girl's Trial;;;;The Hanging of William Carr;Négrillons;Scenes in San Francisco (No. 2);;;Die Liebe vom Zigeunerstamm;
448;;;;;;;;An Indian Sunbeam;;;;Cancan;Foottit et Chocolat, II. Acrobates sur la chaise;The Doll's Revenge;;;Doctor Satanson;
449;;;;;;;;Broncho Billy Outwitted;;;;Clin d'éventail;Foottit et Chocolat, I. Boxeurs;长坂坡;;;Stapellauf des Imperator;
450;;;;;;;;The Ranchman's Trust;;;;Baisers envolés;Street Traffic in Front of Mickiewicz’s Monument;Stealing the Roast Duck;;;Ein Matrosenabenteuer in Hamburg;
451;;;;;;;;Broncho Billy's Escapade;;;;The Transformation of a Hat;Carriers Leaving Building, U.S.P.O. (No. 2);Scenes at Creusot's Steel Foundry;;;Die Berliner Range. 1. Streich: Lotte als Schulschreck;
452;;;;;;;;A Moonshiner's Heart;;;;Nicholas Sisters Split Dance;Jeffries Throwing the Medicine Ball;Love and Fortune;;;Der violette Tod;
453;;;;;;;;A Story of Montana;;;;Faust and Mephistopheles;Jeffries Sparring with His Brother;Robin Hood and His Merry Men;;;Dämon und Mensch;
454;;;;;;;;On the Cactus Trail;;;;The Sprinkler Sprinkled;Jeffries Skipping the Rope;La Fille De L’armateur;;;Lola Montez;
455;;;;;;;;Broncho Billy and the Indian Maid;;;;Pont du Mont-Blanc, Genève;Jeffries Side Stepping and Wrestling;La Confession;;;Auf Probe gestellt;
456;;;;;;;;The Foreman's Cousin;;;;Animation sur la Marktplatz à Saint-Gall;Jeffries Exercising in His Gymnasium;Jealous Wife;;;Pro domo;
457;;;;;;;;Broncho Billy's Gratitude;;;;Circulation sur la Börsenplatz à Saint-Gall;A Trip Through Paris, France in The 1890s;Susan Tastes Our Wine;;;Der letzte Tag;
458;;;;;;;;Western Hearts;;;;Marché à Berne;The Pajama Dance;Les Trois Phases De La Lune;;;Finland;
459;;;;;;;;A Child of the Purple Sage;;;;Montreux: panorama pris du funiculaire Territet - Glion;Scenes by the Stone Jetty, Morecambe;Sœur Angélique;;;Vergebens;
460;;;;;;;;On El Monte Ranch;;;;Panorama pris d'un train assurant la ligne Glion - Rochers-de-Naye;Morecambe Pier;Mare Tempestoso;;;Japanese Sacrifice;
461;;;;;;;;The Desert Sweetheart;;;;La fosse aux ours de Berne;Morecambe Promenade & Winter Gardens;The Gentleman Thief;;;Der Volontär;
462;;;;;;;;The Sheriff and His Man;;;;Cortège d'enfants à Aarau;Parade on Morecambe Central Pier;The Priest's Devotion;;;Die blaue Maus;
463;;;;;;;;The Dead Man's Claim;;;;Deuxième cortège pour l'inauguration du Musée National Suisse;West End Pier, Morecambe;Dans l'Hellade;;;Fürstenliebe;
464;;;;;;;;Alkali Ike's Bride;;;;Premier cortège pour l'inauguration du Musée National Suisse;Parade on West End Pier, Morecambe;A Native Street in India;;;Die roten Schuhe;
465;;;;;;;;Broncho Billy and the Bandits;;;;Cortège du centenaire, Place de la Riponne;A Good Time with the Organ Grinder;Indian Scenes;;;Der Schreiber und die Biene;
466;;;;;;;;The Indian and the Child;;;;Défilé dans la ville de Morat;Tub Race;La crinoline;;;Der Nähkasten;
467;;;;;;;;Under Mexican Skies;;;;Cortège du Carnaval de Bâle, I;The Outcast and the Bride;Paris Slums;;;Sekt-Zauber;
468;;;;;;;;Broncho Billy and the Girl;;;;Cortège du Carnaval de Bâle, IV;Smashing a Jersey Mosquito;"The Snapshot Fiend; or, Willie's New Camera";;;Tanz der Flaschen (Kupferberg Gold);
469;;;;;;;;A Road Agent's Love;;;;Mardi Gras Carnival;C'est complet!;Dranem's Dream;;;Tanz der Flaschen (Maggi);
470;;;;;;;;An Arizona Escapade;;;;Cortège du Carnaval de Bâle, V;A Shocking Accident;For a Wife's Honor;;;Die Suppe;
471;;;;;;;;The Deputy's Love Affair;;;;Cortège du Carnaval de Bâle, III;Christening and Launching Kaiser Wilhelm's Yacht 'Meteor';For Love of Gold;;;Die Korsett-Anprobe;
472;;;;;;;;The Sheriff's Adopted Child;;;;Saut de haies et course à l'hippodrome de Schützenmatte à Bâle;Target Practice, and What Happened to Widow Flaherty;The Man and the Woman;;;Bitte um die Hand Ihrer Tochter;
473;;;;;;;;The Bandit's Child;;;;Saut de haies par des militaires à l'hippodrome de Schützenmatte à Bâle;All on Account of Eliza;The Fight for Freedom;;;Lebenswogen;
474;;;;;;;;The Smuggler's Daughter;;;;Exercices de tir;Two Rubes at the Theatre;A Great Discovery;;;Forger's Doom;
475;;;;;;;;The Ranch Girl's Mistake;;;;Mise en place d'une batterie;Inauguration of the Commonwealth;The Female Spy;;;Die Sünden der Väter;
476;;;;;;;;Alkali Ike's Love Affair;;;;Suisse: Exercices de tir par l'artillerie;L'eau merveilleuse;Satan's Railway Ride;;;Ulk im Film;
477;;;;;;;;The Oath of His Office;;;;Promenade au Mont de Baulmes;Deaf Mute Recitation;Weird Fantasies;;;Die Goldquelle;
478;;;;;;;;Widow Jenkins' Admirers;;;;Jeux à la campagne;Surrender of Kroonstad to Lord Roberts;The Riderless Bicycle;;;Die Claudi vom Geiserhof;
479;;;;;;;;The Sheepman's Escape;;;;Children Dancing with Barrel Organ;Shelling the Red Cross;Homework and Street Scenes in China;;;Die Kinder des Majors;
480;;;;;;;;The Tenderfoot Foreman;;;;Brighton Seagoing Electric Car;In a Chinese Restaurant;Youghal Clock Tower;;;Der Eisenbahnmarder;
481;;;;;;;;A Child of the West;;;;Corpus Christi Procession, Orvieto;A Morning Wash;Sambo as Footman;;;Die sterbende Salome;
482;;;;;;;;The Girl Back East;;;;Annie G. Galloping;The Wrong Door;Orpheline !;;;Clown Charly;
483;;;;;;;;The Outlaw Deputy;;;;McKinley and Hobart Parade at Canton, O.;Algiers-Koléa Line: Tunnel of Point Pescade;A la base cour;;;Ehre;
484;;;;;;;;Broncho Billy and the Vigilante;;;;De Brandweer-film te Delft;Postman Picking up Mail;Colpa e Pentimento;;;"Der Erbe von ""Het Steen""";
485;;;;;;;;Broncho Billy's Brother;;;;Zwemplaats voor Jongelingen te Amsterdam;The Bathers;Street Scenes in Perth, Western Australia;;;Hedda Vernon's Bühnensketch;
486;;;;;;;;Broncho Billy's Vengeance;;;;Spelende kinderen;Skating on Lake, Central Park;Spring;;;Die Gespensteruhr;
487;;;;;;;;Broncho Billy's Teachings;;;;Gestoorde hengelaar;The Departure of the Second Contingent for the Boer War;Meeting of the Motion Pictures Patents Company;;;Heimgekehrt;
488;;;;;;;;The Forester's Plea;;;;Arrival of a Two-Stage Train in France;Cake Walk;Les Allumettes animées;;;The Sign of the Star;
489;;;;;;;;A Western Redemption;;;;The Card Game;Policeman and Burglar;Indian Washing the Baby;;;The Tango Queen;
490;;;;;;;;The Stage Driver's Daughter;;;;The Coney Island Bikers;The Dull Razor;Making Faces;;;Wie sie sich wiederfanden;
491;;;;;;;;The Sheriff's Decision;;;;Vistas de Palermo;Two Old Sports;The Wig Chase;;;Kaiser Wilhelm II. beim Besuche der Vulkan-Werft in Stettin am 4. Mai 1897;
492;;;;;;;;The Strike at the Little Jonny Mine;;;;Short Stick Dance;Scandal Over the Teacups;Reminicências;;;Das Laster;
493;;;;;;;;Broncho Billy's Secret;;;;Silver Dance;The Harry-Alaska in the Chinese Restaurant;Bakhchisaraysky fontan;;;Der Wilderer;
494;;;;;;;;Broncho Billy's Squareness;;;;Dance of Rejoicing;Demonstrating the Action of the Chicago Pneumatic Shell Riveters on the Underside of the Hull of a Steel Vessel. Taken for the Chicago Pneumatic Tool Co.;"Hawaiians Departing to Attend a ""Luau"" or Native Feast";;;Der Wilderer;
495;;;;;;;;The Power of Good;;;;Paddle Dance;Funerali di Giuseppe Verdi a Milano;La Sociedad Atlética en el Campo de Lamiako;;;Bummelstudenten;
496;;;;;;;;The Indian Maid's Sacrifice;;;;Fred Ott’s Gestures;Défense d'afficher;The Cheekiest Man on Earth;;;Monsieur Pyp als Champignonzüchter;
497;;;;;;;;An Indian's Sacrifice;;;;Woman Turning And Walking Upstairs;The Animated Poster;Une Joueuse Enragée;;;Papa will verduften;
498;;;;;;;;The Millionaire and the Squatter;;;;Paris: firefighters, I. Passage of the pumps;Carriers Leaving Building, U.S.P.O.;Médor au téléphone;;;Das lebende Rätsel;
499;;;;;;;;The Puncher's Law;;;;Two deer jumping;Little Miss Lillian;Comedy Cartoons;;;The Devil's Eye;
500;;;;;;;;Broncho Bill's Last Spree;;;;Two dogs racing;Pilot Leaving 'Prinzessen Victoria Luise' at Sandy Hook;Vampires of the Coast;;;Die Millionenmine;
501;;;;;;;;A Western Girl's Sacrifice;;;;Two men boxing, one falls on mattress;Day at the Circus;Female Rivals;;;Teddy als Ehestifter;
502;;;;;;;;Spike Shannon's Last Fight;;;;Two Men Boxing;'Columbia' and 'Shamrock II': Turning the Outer Stake Boat;Voilà mon mari;;;Luny als Chinese;
503;;;;;;;;The Redemption of Broncho Billy;;;;Two men fencing;Living Pictures;San Francisco After the Earthquake and Fire of 1906;;;Der Fall Hirn;
504;;;;;;;;A Pal's Oath;;;;Two women sitting on the ground and smoking;'Reliance' and 'Shamrock III' Jockeying and Starting in First Race;Scenes in San Francisco. [No. 1];;;The Yellow Peril;
505;;;;;;;;The Two Fugitives;;;;Women are passing each other by;Steamscow 'Cinderella' and Ferryboat 'Cincinnati';The Tavern Keeper’s Daughter;;;Die Peitsche;
506;;;;;;;;The Cattle King's Daughter;;;;A gymnast performing on the rings;'Reliance' vs. 'Shamrock' III, Aug. 20;Chiffonniers et caricaturistes;;;Der Todesritt auf dem Riesenrad;
507;;;;;;;;The Outlaw Samaritan;;;;A double amputee climbing on to a chair, descending from a chair;The Maasbrug in Rotterdam;"An Awful Skate; or, The Hobo on Rollers";;;Der Trompeter von Säckingen;
508;;;;;;;;The Backwoodsman's Suspicion;;;;A gargantuan woman getting up off the ground;The Puzzled Bather and His Animated Clothes;Jeannot veut épouser une danseuse;;;Halkas Gelöbnis;
509;;;;;;;;Broncho Billy-Guardian;;;;Sunderland;Panorama of the Paris Exhibition No. 3;Ein Walzertraum;;;Purzel als Tennisspieler;
510;;;;;;;;The Corporation and the Ranch Girl;;;;Puwente de España;Visit to Pompeii;Casino Lied;;;Ein moderner Brutkasten;
511;;;;;;;;At the Break of Dawn;;;;Panorama de Manila;Rock Drill at Work in Subway;Palermo illustrata;;;Madame d'Ora;
512;;;;;;;;The Hidden Mine;;;;Sunday in Binondo;15th Infantry;Rempailleur de chaises;;;Colomba;
513;;;;;;;;The Tribe's Penalty;;;;Women Washing Clothes;In the Photographer's House;Bajazzo;;;Das große Schweigen;
514;;;;;;;;The Lucky Card;;;;Fiesta de Quiapo;L'Illusionniste fin de siècle - Remake;Prolog aus Bajazzo;;;Weil ich dich liebe;
515;;;;;;;;The Puncher's New Love;;;;Intramuros;The Misadventures of Mr. Boit-Sans-Soif;La scuola di cavalleria in Pinerolo;;;Unverstanden - Die Tragödie eines Kindes;
516;;;;;;;;The Bunco Game at Lizardhead;;;;Bamboo Dancers;Les miracles du Brahmine;Le déserteur;;;Lorenzo Burghardt;
517;;;;;;;;What a Woman Can Do;;;;Escenas Callejeras;The Flying Woman;L'amoureux ensorcelé;;;Die Brüder von Zaarden;
518;;;;;;;;Broncho Billy and the Red Man;;;;Man walking downstairs carrying a basket;Benvenuto Cellini or A Curious Evasion;Macbeth, Shakespeare’s Sublime Tragedy;;;Du sollst keine anderen Götter haben;
519;;;;;;;;The Sheriff's Chum;;;;Woman Enjoying a Smoke;Séparation des soeurs siamoises Radika et Dodika par le docteur Doyen;The Dancer and the King, a Romantic Story of Spain;;;Herr und Diener;
520;;;;;;;;Across the Plains;;;;Large Woman Walking;The Escaped Lunatic;The Shaughraun, an Irish Romance;;;Forget About Luck;
521;;;;;;;;The Romance on 'Bar O';;;;A man walking up stairs;Scrambling for Eggs;"The Despatch Bearer; or, Through the Enemy's Lines";;;Outlawed;
522;;;;;;;;The Outlaw and the Baby;;;;Naked man performing a wrestling lock;Queen Victoria's Visit to Dublin;A Woman's Way;;;Adressatin verstorben;
523;;;;;;;;The Outlaw and the Child;;;;Woman Playing Lawn Tennis;The Divorce;The Stolen Jewels;;;Der weiße Schleier;
524;;;;;;;;The Sheepman's Daughter;;;;Two naked men wrestling;Solar Eclipse;Romeo and Juliet (A Romantic Story of the Ancient Feud Between the Italian Houses of Montague and Capulet);;;Isaak, der Handelsjude;
525;;;;;;;;The Cattleman's Daughter;;;;A Man Lifting a Trunk;Kitty Mahone;The Planter's Wife;;;Amt Zukunft;
526;;;;;;;;Broncho Billy's Bible;;;;Nude man playing baseball, batting;General Bartolomé Mitre  Visits the History Museum;The Ingrate;;;Das Spitzentuch der Fürstin Wolkowska;
527;;;;;;;;Carmenita the Faithful;;;;A Man Walking;Panorama of Grand Harbour, Malta, Showing Battleships, Etc.;The Bandit’s Waterloo (The Outwitting of an Andalusian Brigand by a Pretty Senora);;;Das geborgte Leben;
528;;;;;;;;The Two Reformations;;;;A man running;Tram Journey through Southampton;Daniel Boone/Pioneer Days in America;;;Der Knute entflohen;
529;;;;;;;;The Border Ranger;;;;A man throwing a ball.;Prestwych Platform Scene;Motor Pirates;;;Die Geächteten;
530;;;;;;;;The Mexican's Faith;;;;Eadweard Muybridge using a pickaxe;The Barber Saw the Joke;For a Woman's Sake;;;Der Seelenverkäufer;
531;;;;;;;;The Inference of Broncho Billy;;;;A man bearing load on shoulder;Ladysmith – Naval Brigade Dragging 4.7 Guns into Ladysmith;Lucia di Lammermoor;;;Die tolle Heirat von Laló;
532;;;;;;;;The Count and the Cowboys;;;;Man batting;Battle of Spion Kop: Ambulance Corps Crossing the Tugela River;Der flotte Bursche;;;Ernst ist das Leben;
533;;;;;;;;A Gambler of the West;;;;Lawn tennis, serving;Battleship Odin Firing All Her Guns;A Kind-Hearted Policeman;;;Gesprengte Ketten;
534;;;;;;;;Broncho Billy Well Repaid;;;;Rowing Man;Four Warships in Rough Seas;The Egg Harvest of Flamborough Head;;;Urteil des Arztes;
535;;;;;;;;Trail to the West;;;;Visit of Doña Cristina and Don Alfonso XIII to Barcelona;Warships at Sunset;Our Band's Going to the Competition;;;Die Erbschaft von New York;
536;;;;;;;;The Bad Man's Christmas Gift;;;;Clash of Two Transatlantic Ships;Queen Victoria's Last Visit to Ireland;Native Hawaiian Guards in Bayonet Exercises, H.I.;;;Ich lasse dich nicht;
537;;;;;;;;The Tenderfoot Messenger;;;;The Greetings;King Edward's Arrival at Helsingor;Washing Sheep, Humuula Beach, Hawaii;;;Ich klage an;
538;;;;;;;;Broncho Billy's True Love;;;;Unloading of Coal;Henley Regatta;Shearing Sheep, Humuula Ranch, Hawaii;;;Du meine Himmelskönigin;
539;;;;;;;;Circle C Ranch's Wedding Present;;;;Matadero and Exit of Workers;Le Pétomane du Moulin Rouge;Arrival Mahukona Express, Kohala, Hawaii;;;Der Weg, der zur Verdammnis führt 1. Teil - Das Schicksal der Aenne Wolter;
540;;;;;;;;A Western Woman's Way;;;;Disembarkation of the Wounded from Cuba in our Harbour;The Dance;S.S. 'Kinau' Landing Passengers, Mahukona, Hawaii;;;Bergsünden;
541;;;;;;;;The Little Prospector;;;;Storm at Riazor;Panorama of the River Avon to Portishead;Hawaiians Arriving to Attend a Luau or Native Feast;;;Leuchtende Punkte;
542;;;;;;;;The Marked Trail;;;;Plaza de Mina y Orzán;Autofahrt durch Trier;Hauling Sugar Cane, Kohala Plantation, Hawaii;;;Irrwege der Liebe;
543;;;;;;;;The Treachery of Broncho Billy's Pal;;;;Coal Factory;Indian Review: Grand March Past;Surf Scene, Waikiki, Honolulu, H.I.;;;Der Geheimsekretär;
544;;;;;;;;The Silent Message;;;;San Jorge, Exit of the Mass;Attaque d'une batterie anglaise par les boërs: Prise d'un canon;Chasse en Abyssinie: Chasse au Lion;;;Sein schwierigster Fall;
545;;;;;;;;Pals of the Range;;;;Burial of Gral. Sánchez Bregua;The Forbidden City, Pekin;Terrible Anguish;;;Der gestreifte Domino;
546;;;;;;;;A Cowboy's Mother-in-Law;;;;Rats and Weasel;Bailey's Royal Buxton Punch And Judy Show In Halifax;Surf Board Riders, Waikiki, Honolulu, Hawaiian Islands;;;Das Wunder der Madonna;
547;;;;;;;;The Bearded Bandit;;;;Rats and Terrier No. 3;Excursion en Italie – De Naples au Vésuve;"The ""Float,"" Waikiki, Honolulu, Hawaiian Islands";;;Mirko Pasqua;
548;;;;;;;;Patricia of the Plains;;;;Amsterdam Central Station;The Revolving Table;Panoramic View, Oahu Railroad, Haleiwa, Hawaiian Islands;;;Maria Evere;
549;;;;;;;;Broncho Billy's Strategy;;;;Funeral Procession in Rome;Magic Extinguisher;Pa-u Riders, Hawaiian Islands;;;Teddy wird verpackt;
550;;;;;;;;The Pony Express Rider;;;;Vienna;Attack on a Mission Station;Panoramic View, Oahu Railroad, Pearl Harbor, Hawaiian Islands;;;Das unheimliche Haus;
551;;;;;;;;An Indian Girl's Love;;;;Ostrich Running;The Dispatch Bearer;"S.S. ""Kinau"" Landing Passengers, Laupahoihoi, Hawaiian Islands";;;Der Herzenknicker;
552;;;;;;;;Broncho Billy and the Schoolmam's Sweetheart;;;;99e régiment d’infanterie : anneaux et trapèze;Hull F.C. v Wigan;Surf Scene, Laupahoihoi, Hawaiian Islands;;;Die Macht des Walzers;
553;;;;;;;;The Deputy's Love;;;;Sortie de fabrique;Runcorn v St Helens;Shipping Cattle, Kawaihae, Hawaiian Islands;;;Rennfieber;
554;;;;;;;;The Dumb Half Breed's Defense;;;;A Midnight Episode;Hull FC v. Hull Kingston Rovers;Loading Sugar, Kahului, Maui, Hawaiian Islands;;;Es werde Licht!;
555;;;;;;;;The Girl on Triple X;;;;Ostriches Running, No. 1;Hull Kingston Rovers v Wigan;Panoramic View, Crater of Haleakala, Hawaiian Islands;;;Es werde Licht! 2. Teil;
556;;;;;;;;Under Western Skies;;;;Bull Fight, no. 3;Arrival of the Shah in London;"""Snap Shots"", Hawaiian Islands";;;Für die Ehre des Vaters;
557;;;;;;;;The Desperado;;;;Les congierges;Watermelon Eating Contest;Scenes on a Sugar Plantation, Hawaiian Islands;;;Das goldene Bett;
558;;;;;;;;Trailed to the Hills;;;;Les démolisseurs;Interrupted Lovers;Panoramic View, Honolulu Harbor, Hawaiian Islands;;;In Vertretung;
559;;;;;;;;The Unknown Claim;;;;Children Playing on the Beach at Rhyl;How the Old Woman Caught the Omnibus;Panoramic View, King St. Honolulu, Hawaiian Islands;;;The Hunt for the One Hundred Pound Note or The Journey Around the World;
560;;;;;;;;The Bad Man's Last Deed;;;;Le Rotisseur;The Prodigal Son;Panoramic View, Waikiki from an Electric Car, Hawaiian Islands;;;Das Geheimnis von Chateau Richmond;
561;;;;;;;;The Forest Ranger;;;;Les Bulles de Savon;Anna Held;Crowds Returning from the Games, Waikiki, Hawaiian Islands;;;Das schwarze Los;
562;;;;;;;;The Bandit's Wife;;;;L'Équilibriste;Photo-Cinéma-Théâtre: Christine Kerf dans Terpsichore;Round Brussels in 10 Minutes;;;Kasperl-Lotte;
563;;;;;;;;The Ranchman's Feud;;;;Les Chiens Savants;Gavotte;An Introduction to the Actual Condition of Taiwan;;;The Waves of the Sea and Love;
564;;;;;;;;Away Out West;;;;Le Steeple-chase;L'exposition universelle de 1900. La rue de Nations II;Kanaka Fishermen Casting the Throw Net, Hilo, H.I.;;;Frühlings-Erwachen;
565;;;;;;;;The Brother, Sister and the Cowpuncher;;;;Le Repas des Poulets;The Latest News;Panoramic View of Waikiki Beach, Honolulu, H.I.;;;The Silent Mill;
566;;;;;;;;The Little Doctor of the Foothills;;;;Le Fumeur;Mt. Pelee Smoking Before Eruption (St. Pierre, Martinique);Cuore di mamma;;;The Story of Dida Ibsen;
567;;;;;;;;The Cowpuncher's Ward;;;;La Balançoire;Mt. Pelee in Eruption and Destruction of St. Pierre (Martinique);Macbeth;;;Das Tagebuch einer Verlorenen;
568;;;;;;;;The Sheriff's Sacrifice;;;;La Charmeuse;Savable Wins;After nine in the evening;;;Der Rubin-Salamander;
569;;;;;;;;A Vein of Gold;;;;Le Trapèze;Horse Racing in Germany;The River Ozu, Japan;;;Der Prozeß Hauers;
570;;;;;;;;The Cowboy's Sweetheart;;;;Le Jeu du Volant;Paseo a Playa Ancha;The Magic Sack;;;The Miller and His Child;
571;;;;;;;;The Bad Man and the Preacher;;;;Zim, Boum, Boum;Ejercicio general de Bombas;The Rose;;;Die Jüdin;
572;;;;;;;;The Mistaken Bandit;;;;Le Jeu de Corde;Alfred Raymond, Agnes May, & Wilfred Sydney;And the Villain Still Pursued Her, or, the Author's Dream;;;Der König amüsiert sich Rigoletto;
573;;;;;;;;The Ranger's Bride;;;;The Aquarium;Beheading a Chinese Boxer;A Policeman's Love Affair;;;Der Doppelselbstmord;
574;;;;;;;;The Faithful Indian;;;;Dancing on the Rope;How Bridget Made the Fire;For Mother's Birthday;;;Im Banne der Pflicht;
575;;;;;;;;The Girl and the Fugitive;;;;La Zambelli;The Runaway Match, or Marriage by Motor;Les Jeux Olympiques de Londres;;;Frauenehre;
576;;;;;;;;The Fence on 'Bar Z' Ranch;;;;Trained Bears;The Last Days of Pompeii;Intercalated Games;;;The Beggar Countess;
577;;;;;;;;The Ranch Girl's Legacy;;;;Man Taking Off His Boater;Are You There?;La folie de Pierrot;;;Theodor Körner;
578;;;;;;;;Broncho Billy and the Navajo Maid;;;;Woman Pouring from Jug;Little Red Riding Hood;Course de taureaux à Nîmes;;;Aegir: Ein Film-Festspiel;
579;;;;;;;;Broncho Billy's Mistake;;;;Woman Setting Down Jug;Murder Scene from 'King of the Detectives';La porteuse de pain;;;Die blaue Laterne;
580;;;;;;;;Broncho Billy Reforms;;;;Crossing Brook on Step-Stones with Fishing Pole and Can;The Story the Biograph Told;Le bon écraseur;;;Die Büchse der Pandora;
581;;;;;;;;Broncho Billy and the Rattler;;;;Woman Picking Up Child;Jeffries in His Training Quarters;Mireille;;;Svengali;
582;;;;;;;;Alkali Ike's Pants;;;;Woman Getting Into Bed;Parade of Eagles, New York;Tartarin de Toulouse;;;The Priest from Kirchfeld;
583;;;;;;;;The Cowboy and the Squaw;;;;Woman Opening Umbrella;Panoramic View of the McKinley Homestead;Un coup de vent;;;The Wedding of Valeni;
584;;;;;;;;Western Chivalry;;;;Woman Sitting Down;Funeral of President McKinley;Von Stufe zu Stufe;;;Johann Strauß an der schönen blauen Donau;
585;;;;;;;;The Outlaw's Sacrifice;;;;Fregoli trasformista;C.I.V. Procession: Cyclists and Infantry;Une Famille nombreuse;;;The Giant's Fist;
586;;;;;;;;Won by a Hold-Up;;;;Fregoli al ristorante;A Catastrophe in Hester Street;Les deux espiègles;;;A Trip through Berlin;
587;;;;;;;;A Western Maid;;;;Corso cycliste;'Holy Moses' the Camel;Mariez-vous donc;;;The War Sofa;
588;;;;;;;;The Heart of a Cowboy;;;;Au réfectoire;The Bad Boy's Joke on the Nurse;Pussy's Breakfast;;;Little Angel's Wedding;
589;;;;;;;;The Spanish Girl;;;;Children Playing in the Garden;Burning of the Academy of Music, Brooklyn;Good Evening, the Flower Fairy;;;Death in Seville;
590;;;;;;;;The Ranchman's Rival;;;;From War to Peace: First Departure of S.S. 'St. Louis' from Southampton;Orphans in the Surf;Noisy Neighbors;;;Gypsy Blood;
591;;;;;;;;Judgment;;;;Pere cotte;Tying the Red Light on the Tiger's Tail;Firefighting Exercise;;;The False Asta Nielsen;
592;;;;;;;;The Best Man Wins;;;;Segreto per vestirsi (con aiuto);Fusion, on to Brooklyn!;Un petit frère sous les choux;;;Extra-Ausgabe der Messter-Woche;
593;;;;;;;;The Indian Trailer;;;;Passage de la Marne par les chevaux du 28e Dragons;The Haymarket;L'institut de beauté;;;Kiews Schreckenstage;
594;;;;;;;;A Tale of the West;;;;Métamorphoses d'un magicien;Native Women Coaling a Ship and Scrambling for Money (West Indies);Les femmes chauffeuses;;;Waarschuwing tegen de revolutie;
595;;;;;;;;The Road Agents;;;;Le Président Félix Faure aux courses;Native Woman Washing a Negro Baby in Nassau, B.I.;Wonderful Flames;;;Misericordia;
596;;;;;;;;The Life of an American Cowboy;;;;Garde républicaine à cheval;The Vaidis Sisters, Luna Park;Danses andalouses;;;Michel and Viktoria;
597;;;;;;;;The Bandit Makes Good;;;;Bois de Boulogne;Swimming Pool at Coney Island;Christy Mathewson and the New York National League Team;;;Rentier Kulicke's Flug zur Front;
598;;;;;;;;Western Justice;;;;Baigneurs et plongeurs;Spider and the Fly;The Warwick Pageant;;;Karl Valentin privat und im Atelier;
599;;;;;;;;A Brush Between Cowboys and Indians;;;;Arrestation d'un ivrogne;Slide for Life, Luna Park;The Secret of Death Valley;;;A Car Ride in the Pyrenées;
600;;;;;;;;When a Man Sees Red;;;;Deyo;Down the Bamboo Slide;Victime des créanciers;;;Nature's Fairest;
601;;;;;;;;True Blue;;;;Noon Cannon Firing on the Marian Walls;Arab Act, Luna Park;Une femme trop pressée;;;Ideale Filmerzeugung;
602;;;;;;;;The Outlaw Reforms;;;;Old Town Firemen;Loading a Vessel at Charleston, S.C.;The Regret;;;William Voss;
603;;;;;;;;Life on the 101 Ranch, Bliss Oklahoma;;;;Exercises with Indian Clubs by the Sokol of Malá Strana;Bally-Hoo Cake Walk;The Good Judge;;;A Visit to the Champagne Factory Mercier;
604;;;;;;;;Staking His Life;;;;Cyclists;The Reversible Divers;Le billet de logement;;;Oath Taking of Grand Duchess Marie-Adélaïde;
605;;;;;;;;The Border Wireless;;;;March Past During Corpus Christi Feast in Hradčany;Balloon Race;La chaussette;;;Funeral Procession of Grand Duke Guillaume IV;
606;;;;;;;;A Lion of the Hills;;;;Escorting the Cradle of František Palacký from Hodslavice to the Prague Exhibition Grounds;Washing Clothes at Sicily;Kongebesøg i Aarhus 1906;;;Flower Parade 1906;
607;;;;;;;;The Devil's Double;;;;Foundation Ceremony of the František Palacký Monument;Tourists Landing at Island of Capri, Italy;Douaniers et fraudeurs;;;Cavalcade;
608;;;;;;;;Grit;;;;Vaulting of the Prague Sokol Equestrian Section;Vue prise d'une plate-forme mobile III;Douanier séduit;;;Final Procession at the Octave;
609;;;;;;;;Cash Parrish's Pal;;;;Žofín Swimming Bath;Arrival of McKinley’s Funeral Train at Canton, Ohio;Opération chirurgicale;;;Dancing Procession at Echternach;
610;;;;;;;;The Conversion of Frosty Blake;;;;Bullfighting: Bullfighting School;San Francisco Chinese Funeral;The Language of Flowers;;;Blumenkorso 1914;
611;;;;;;;;The Grudge;;;;Removal of the Bull;Voilà le colonel!;L'assassinat du grand-duc Serge;;;Leben und Treiben auf dem Viehmarkt;
612;;;;;;;;Two-Gun Hicks;;;;Bullfighting: Estocada;Panorama de Constantine;La perruque;;;Impressions of Trier;
613;;;;;;;;A Ranch Romance;;;;Bullfighting: Cape Passings;Le marchand de statues;Duel Scene from Macbeth;;;The Corpus Christi Procession in Trier;
614;;;;;;;;Broncho Billy's Cowardly Brother;;;;Bullfighting: Picadors, Overturned Horse;Pocket Boxers;Déménagement à la cloche de bois;;;Domausgang am Ostersonntag;
615;;;;;;;;Broncho Billy's Christmas Deed;;;;Bullfighting: Start;Lifting a Wagon from a New York Foundation;Au jardin zoologique de Paris;;;Domausgang in Trier;
