Griffith;Feuillade;Bauer;Sjostrom;Chaplin;Weber;Guy;Western;Terror;Scifi;Animacion;Origenes1;Origenes2;Origenes3;Italia;Dinamarca;Alemania;IGM;Todas
;;;;;;;;;;;Belfast, pompiers : Un Incendie, I;Morecambe Church Lads' Brigade at Drill;Life and Events in Tangka;;;;;The Dark Romance of a Tobacco Tin
;;;;;;;;;;;O Vira;Miners Leaving Pendlebury Colliery;Jamaica Negroes Doing a Two-Step;;;;;The Prodigal Son
;;;;;;;;;;;Bluebeard;Sedgwick's Bioscope Show Front;Interrupted Crap Game;;;;;Béatrix Cenci
;;;;;;;;;;;A Visit to the Spiritualist;Jamaica Street, Glasgow;"The 100 to One Shot; or, A Run of Luck";;;;;Puffy Buys Shoes
;;;;;;;;;;;The Cavalier's Dream;Preston Egg Rolling;The Huguenot;;;;;Play Ball with Babe Ruth
;;;;;;;;;;;Portuguese Railway Train;Manchester Band of Hope Procession;How Rastus Got His Pork Chop;;;;;The Secret of the Submarine
;;;;;;;;;;;Fun on the Clothesline;Manchester Street Scene;Her First Biscuits;;;;;Miss Bellboy
;;;;;;;;;;;Amann, the Great Impersonator;Parkgate Iron and Steel Co., Rotherham;The Girl from Montana;;;;;Alraune, die Henkerstochter, genannt die rote Hanne
;;;;;;;;;;;Menai Bridge, the Day Irish Mail from Euston Entering the Tubular Bridge Over the Menai Straits;Ride on the Tramcar Through Belfast;The Execution of Dorrego;;;;;The Indian Sorcerer
;;;;;;;;;;;Panoramic View of Frere Camp Taken from the Front of an Armoured Train;North Sea Fisheries, North Shields;"Francesca di Rimini; or, The Two Brothers";;;;;Hoodoo Ann
;;;;;;;;;;;Neapolitan Dance at the Ancient Forum of Pompeii;A Frightful Night;The Exploits of Three-Fingered Kate;;;;;The Agony of Byzantium
;;;;;;;;;;;Venice, Feeding the Pigeons in St. Mark's Square;20,000 Employees Entering Lord Armstrong's Elswick Works, Newcastle-upon-Tyne;Dumb Sagacity;;;;;Eerie Tales
;;;;;;;;;;;Charlie Wanted the Earth;Mr. Pecksniff Fetches the Doctor;To a Good Cat, a Good Rat;;;;;A Victorian Lady in Her Boudoir
;;;;;;;;;;;Pulmonary Hydatid Cyst Operation;Drat That Boy;Bernadette Soubirous and the Apparitions of Lourdes;;;;;L'engrenage
;;;;;;;;;;;Tossing a Nigger in a Blanket;The Kiddies' Cakewalk;Count Ugolino;;;;;The Coward
;;;;;;;;;;;Bombardment of Mafeking;Hammerfest;A Comedy of Errors;;;;;His First Job
;;;;;;;;;;;Panoramic View of Conway on the L. & N.W. Railway;The Delhi Durbar;The Colored Stenographer;;;;;"Polin Performs ""The Anatomy of a Draftee"""
;;;;;;;;;;;The Last Round Ended in a Free Fight;Coronation Durbar at Delhi;Le Festin de Balthazar;;;;;Hustling for Health
;;;;;;;;;;;Boxing for Points;The Extraordinary Waiter;Calino joue au billard;;;;;Spring Fever
;;;;;;;;;;;Panoramic View of Brooklyn Bridge;His Only Pair;The Legend of Daphne;;;;;Ali Baba and the Forty Thieves
;;;;;;;;;;;Gigolos et gigolettes;The Magic Sword;Le Lys d'or;;;;;Weaving Women
;;;;;;;;;;;Across Brooklyn Bridge;The Deonzo Brothers;A Father's Honor;;;;;The Black Viper
;;;;;;;;;;;A Volunteer Fire Company;Artistic Creation;The Lady with the Camellias;;;;;Spanish Bullfight
;;;;;;;;;;;Mount and Dismount, Gatling Gun;The Waif and the Wizard;The Robber's Sweetheart;;;;;Leisurely Pedestrians, Open Topped Buses and Hansom Cabs with Trotting Horses
;;;;;;;;;;;Moulin Rouge Dancers;The Cheese Mites, or Lilliputians in a London Restaurant;Building a British Railway: Crewe Railway Junction;;;;;The Monastery of Sendomir
;;;;;;;;;;;Merry-Go-Round;His Brave Defender;Bruto;;;;;Leone XIII
;;;;;;;;;;;Theatre Hats Off;An Exciting Pillow Fight;The Blacksmith's Daughter;;;;;Living Sculptures: Film Study for Screen Artist
;;;;;;;;;;;The Theatre Hat;Entry of the Scots' Guards into Bloemfontein;The Wooing and Wedding of a Coon;;;;;Lancement d'un navire
;;;;;;;;;;;Fun on the Steeple-Chase;Cronje's Surrender to Lord Roberts;King of the Cannibal Islands;;;;;Writing Backwards
;;;;;;;;;;;Ambulance at the Accident;Army Life: Mounted Infantry;Dingjun Mountain;;;;;The Triple Conjurer and the Living Head
;;;;;;;;;;;Shoot the Chutes Series;Rough Sea;The Dancing Nig;;;;;1776, or The Hessian Renegades
;;;;;;;;;;;Atlantic City Fire Department;A Desperate Poaching Affray;Charlotte Corday;;;;;Horse and Rider Jumping Over an Obstacle
;;;;;;;;;;;New Brooklyn to New York via Brooklyn Bridge, No. 1;A Daring Daylight Burglary;Beauty Contest Among Children at Turin;;;;;President McKinley Taking the Oath
;;;;;;;;;;;The Battery;Buy Your Own Cherries;In den dierentuin van Antwerpen;;;;;The Indian Runner's Romance
;;;;;;;;;;;Sea Waves;Troubles of a Manager of a Burlesque Show;Napoléon;;;;;Straight Shooting
;;;;;;;;;;;Projectile from Ten Inch Disappearing Gun Striking Water, Sandy Hook;From Show Girl to Burlesque Queen;Monkeyland, a Jungle Romance;;;;;The Merry Jail
;;;;;;;;;;;Asian Delegations;The Georgetown Loop (Colorado);Donkey Skin;;;;;A Fallen Spirit
;;;;;;;;;;;Bruxelles, la bourse;The Other Side of the Hedge;Boxing Fever;;;;;The Drummer of the 8th
;;;;;;;;;;;Bruxelles, Place de Brouckère;How to Stop a Motorcar;Confidence;;;;;A Sticky Woman
;;;;;;;;;;;Bruxelles, Sainte-Gudule;Kiss Me!;Resurrection;;;;;By Indian Post
;;;;;;;;;;;Anes;The Old Maid's Valentine;Wolf Hunt;;;;;Fencing
;;;;;;;;;;;Serpentine Dance - Annabelle;The Death of Poor Joe;After Many Years;;;;;El golfo
;;;;;;;;;;;Sortie d'église en Bohême;Conquering the Skies;Making It Pleasant for Him;;;;;The Springtime of Life
;;;;;;;;;;;Arrivée de 'La Champagne';The Imperceptible Transmutations;The Dangers in a Fisherman’s Life;;;;;Princess Ali
;;;;;;;;;;;Diving Through Paper Screens;"Félix Mayol Performs ""White Lilacs""";Oliver Twist;;;;;Vendémiaire
;;;;;;;;;;;Around the Big Curves;"Félix Mayol Performs ""Indiscreet Questions""";Les Misérables;;;;;Serpentine Dance by Mme. Bob Walter
;;;;;;;;;;;Colonial Troops and Cavalry;Saharet Performs the Bolero;The Joneses Have Amateur Theatricals;;;;;The Haunted Curiosity Shop
;;;;;;;;;;;Review of the Life Guards by the Queen;Cake-walk nègre;La Bous-Bous-Mie;;;;;Infantry and Cavalcade on the Occasion of the Young Turks
;;;;;;;;;;;Dispersing the Troops at Windsor After Parade;The Magician's Alms;Antos in Warsaw For the First Time;;;;;Pharmaceutical Hallucinations
;;;;;;;;;;;First Northumberland Fusiliers Digging Entrenchments;The Statue;The Magic Purse;;;;;New York, Whitehall Street
;;;;;;;;;;;The 'Roslin Castle' (Troopship) Leaving for South Africa;The Landlady;Tomkins Buys a Donkey;;;;;A Midsummer Night's Dream
;;;;;;;;;;;Churned Waters;At the Photographer's;La Tosca;;;;;The Inn Where No Man Rests
;;;;;;;;;;;General Buller Embarking on the 'Dunottar Castle' at Southampton;Automated Hat-Maker and Sausage-Grinder;C'est Papa qui a pris la purge;;;;;A Hand Shake
;;;;;;;;;;;Un caz de hemiplegie isterica vindecat prin sugestie hipnotica;Panoramic View of the Morecambe Sea Front;Fiskerliv i Norden;;;;;Paris, le Pont-Neuf
;;;;;;;;;;;Walking Troubles of Organic Hemiplegy;The Three Musketeers;Balked at the Altar;;;;;Douche après le bain
;;;;;;;;;;;Dance espagnole par 'La Belle' Otero;The Seahawk;Pat Corner;;;;;An Arcadian Maid
;;;;;;;;;;;Theodore Roosevelt Leaving the White House;Nekojiru Grass;A Message to Napoleon at Elba;;;;;Boys Playing Leapfrog: Side View
;;;;;;;;;;;President McKinley's Inauguration;Alive 2007;The Witch and the Cyclist;;;;;Naval Combat in Greece
;;;;;;;;;;;Prince Ranjitsinhji Practising Batting in the Nets;Giải cứu thần chết;The Two Gold Diggers;;;;;Boules Game
;;;;;;;;;;;Les bains de la jetée des pâquis;Father's Best Children;The Short-Sighted Governess;;;;;Heart o' the Hills
;;;;;;;;;;;Exposition nationale suisse. Palais des beaux-arts;Action Man - Past Performance;The Little Hornblower;;;;;The Sentimental Bloke
;;;;;;;;;;;Tramway à vapeur et passagers;Shadow of Fear;Princess Marie's Funeral;;;;;The Dumb Girl of Portici
;;;;;;;;;;;Arrivée d'un train;;Training Ship Georg Stage;;;;;The Wave
;;;;;;;;;;;The Derby 1895;;By the Sea;;;;;Lucky Jim
;;;;;;;;;;;The chariot and battle of confetti;;The Mysterious Cigar;;;;;Kiss of Death
;;;;;;;;;;;A Ray of Sunshine After the Rain;;Dr. Cook at Copenhagen;;;;;The Policemen's Little Run
;;;;;;;;;;;Faust and Marguerite;;The Mountaineer's Honor;;;;;New Blacksmith Shop
;;;;;;;;;;;Weary Willie;;Tale of the Ark;;;;;An Angelic Attitude
;;;;;;;;;;;Persimmons Winning the Derby;;Hunting the Panther;;;;;The Ragtime Band
;;;;;;;;;;;The Tramp's Dream;;Elastic Transformation;;;;;Wished on Mabel
;;;;;;;;;;;Thrilling Fight on a Scaffold;;Affairs of the Heart;;;;;Feline Follies
;;;;;;;;;;;Bullfight;;The Music Lesson;;;;;The Star Prince
;;;;;;;;;;;The Broken Melody;;Il piccolo garibaldino;;;;;By the Sad Sea Waves
;;;;;;;;;;;The Maid in the Garden;;Conscience de magistrat;;;;;The Oil Gush in Balakhany
;;;;;;;;;;;Cinderella;;Grundstensnedlæggelse ved Gustav Adolfs Kirke;;;;;The Faun
;;;;;;;;;;;Jeffries-Sharkey Contest;;Diabolical Pickpocket;;;;;Betrayed by a Handprint
;;;;;;;;;;;Lightning Change Artist;;The Frog;;;;;Christian Martyrs
;;;;;;;;;;;Two Naughty Boys Teasing the Cobbler;;Buying a Cow;;;;;Intérieur d'une imprimerie (tirage d'une épreuve)
;;;;;;;;;;;The Devil's Laboratory;;Don Juan Tenorio;;;;;The Corbett-Fitzsimmons Fight
;;;;;;;;;;;The Horitz Passion Play;;Lejonjakten.;;;;;The Whispering Chorus
;;;;;;;;;;;Scene of the Lightning Robber's Being Arrested;;A Trip Through the Canals of Copenhagen;;;;;Damn the War
;;;;;;;;;;;The Hind in the Wood;;Typografernes Strejke;;;;;Bob Kick, the Mischievous Kid
;;;;;;;;;;;Young Griffo v. Battling Charles Barnett;;Modeopvisning - Kjoler;;;;;Kobelkoff
;;;;;;;;;;;The Passion Play of Oberammergau;;Kong Frederik VIII gæster Jylland;;;;;Malombra
;;;;;;;;;;;The Clown Barber;;The Magnetized Man;;;;;Niagara Falls
;;;;;;;;;;;Shooting a Boer Spy;;Skøjteløbning i Fredericia;;;;;Eyes of Youth
;;;;;;;;;;;Col. Theodore Roosevelt and Officers of His Staff;;Københavnerbilleder;;;;;The Fight of Reporters
;;;;;;;;;;;Opening of the Kiel Canal;;Engineers Excavate Skandser and Set Off Blasts;;;;;The Fire
;;;;;;;;;;;Marche Indien sur le canal de la Viga;;Children's Aid Day in Copenhagen;;;;;Alger: rue Bab-Azoun
;;;;;;;;;;;Exercise a la baionette;;May 1 demonstrations in Slagelse;;;;;The Tango
;;;;;;;;;;;Le forum;;Automobiler i Fredensborg;;;;;Matrimony's Speed Limit
;;;;;;;;;;;The Parisians;;Sprængning af Træer i Dyrehaven;;;;;Álarcosbál
;;;;;;;;;;;Danse mexicaine;;Sprængning af Huse i Ordrup Krat;;;;;Tatárjárás
;;;;;;;;;;;X. La mise en croix;;Hestevæddeløb i Sverige;;;;;A tanítónö
;;;;;;;;;;;VI. La cène;;Haslev Agriculture Fair;;;;;A nőstényfarkas
;;;;;;;;;;;Casey at the Bat;;Vore Ingeniører slaar Pontonbro;;;;;The Kiss in the Tunnel
;;;;;;;;;;;Fantastic Dining Room;;Orchestra at Frederiksberg Theater;;;;;An Interesting Story
;;;;;;;;;;;Floral Parade of Lady Cyclists;;Volunteer Boys' Association;;;;;Chamonix: Arrivée en voitures des breaks d'excursion
;;;;;;;;;;;Eagle Dance, Pueblo Indians;;Badende Drenge i Skovshoved Havn;;;;;Partie de tric-trac
;;;;;;;;;;;Chinese Procession;;Zachariæs Selskab;;;;;The Taming of the Shrew
;;;;;;;;;;;Street Scene, San Diego;;Shrovetide Celebrations at Mogensen's;;;;;Seven Keys to Baldpate
;;;;;;;;;;;Colonel Funston Swimming the Bagbag River;;Viking løber af Stabelen;;;;;Faust and Marguerite
;;;;;;;;;;;The Island of Marken;;Fru Ellen Aggerholm;;;;;Young Romance
;;;;;;;;;;;Turin: The Duchess of Aosta at the Exposition;;The Hand of the Artist;;;;;Cortège au mariage de la princesse Maud
;;;;;;;;;;;Poker at Dawson City;;Mr. Hurry-up;;;;;The Famous Box Trick
;;;;;;;;;;;In Single File on the Mountain, l. Montée;;The Unwritten Law: A Thrilling Drama Based on the Thaw-White Tragedy;;;;;Animated Putty
;;;;;;;;;;;In Single File on Glaciers With Snowshoes, l. Montée;;The Fairy of the Black Rocks;;;;;Where the Breakers Roar
;;;;;;;;;;;Mauvais temps au port;;The Enchanted Pond;;;;;Belfast, exercices de sauvetage
;;;;;;;;;;;Locomobile;;The Charmer;;;;;A Modern Monte Cristo
;;;;;;;;;;;27ème chasseurs alpins : assaut d'un mur;;The Pearl Fisherman;;;;;Bokserparodi
;;;;;;;;;;;Explosion en mer;;Den hvide slavinde;;;;;Radeau avec baigneurs
;;;;;;;;;;;Caravane de chameaux;;Kong Frederik VIII besøger Færøerne;;;;;By the Cross
;;;;;;;;;;;Belfast : Pompiers: un incendie, II;;King Frederik VIII Travels to Iceland;;;;;The Unbeliever
;;;;;;;;;;;Liverpool, panorama pris du chemin de fer électrique, IV;;Ellehammers første Forsøg med Aeroplan;;;;;Princess Rajah Dance
;;;;;;;;;;;Déchargement d’un navire;;King Frederik VIII and Kristiania;;;;;Bowery Waltz
;;;;;;;;;;;In Front of Notre-Dame;;The King's Visit to Aarhus on 1. September 1906;;;;;The Speed Kings
;;;;;;;;;;;In a German Bath;;King Haakon's Coronation in Trondheim;;;;;My Brother Is Coming
;;;;;;;;;;;In the Friedrichstrasse;;The King and Queen Drive Between Kroningen and Trondheim Cathedral on 22 June 1906;;;;;Rip's Twenty Years' Sleep
;;;;;;;;;;;The Battleship 'Odin';;King Haakon's Arrival in Trondheim;;;;;The Human Fly
;;;;;;;;;;;German Lancers;;Prinsen og Prinsessen af Wales' Ankomst til Trondhjem;;;;;The Renunciation
;;;;;;;;;;;Changing Guard (Berlin);;Dynamiting Ruins and Rescuing Soldiers Caught in the Fallen Walls;;;;;Snowball Fight
;;;;;;;;;;;Emperor and Empress of Germany;;The Proclamation of King Frederik VIII;;;;;Water Lilies
;;;;;;;;;;;Lady Cyclists;;King Frederik VIII's Proclamation;;;;;Scene from the Elevator Ascending Eiffel Tower
;;;;;;;;;;;The Skaters;;Kong Haakons besøg paa 'Herluf Trolle';;;;;Misfortune Never Comes Alone
;;;;;;;;;;;Gordon Highlanders Leaving for the Boer War;;Militære Opvisninger paa Fælleden;;;;;The Kremos: Perilous Jumps
;;;;;;;;;;;Our New General Servant;;Væddeløbene ved Eremitagen;;;;;The Birth, the Life and the Death of Christ
;;;;;;;;;;;Gardener Watering Plants;;Kongerevue 1906;;;;;A Muddy Romance
;;;;;;;;;;;Trilby Burlesque;;17th of May in Norway;;;;;Cleopatra's Tomb
;;;;;;;;;;;Contortionist;;Lerfossen;;;;;The Life of General Villa
;;;;;;;;;;;Brighton Street Scene;;Kong Haakons og Dronning Mauds Besøg i Danmark;;;;;The Pyramids (Overview)
;;;;;;;;;;;Chegada do Trem em Petrópolis;;King Haakon's Visit to 'Dannenbrog' at Crown Prince Christian's Abode;;;;;Betta the Gypsy
;;;;;;;;;;;Wrestling;;Børnehjælpsdagen 1905, I-III;;;;;Panorama from the Tower of the Brooklyn Bridge
;;;;;;;;;;;Chrysis Waking;;Betting;;;;;A Moonlight Serenade
;;;;;;;;;;;Man on Parallel Bars;;Through Aarhus Gates by Tram;;;;;The Colonel's Shower Bath
;;;;;;;;;;;Making Sausages;;Linotol Comp.;;;;;Dante's Inferno
;;;;;;;;;;;The Children's Seaside Frolic;;King Haakon and Queen Maud's departure from Denmark on 23. November;;;;;Fear
;;;;;;;;;;;A Heavy Sea;;Christmas Miracle;;;;;The Lesser Evil
;;;;;;;;;;;Will Evans, the Musical Eccentric;;Lifting the Lid;;;;;Athlete with Wand
;;;;;;;;;;;Turcos (défilé);;Latina, Dislocation Act;;;;;The Magician's Cavern
;;;;;;;;;;;Paris : général Saussier et son état-major;;Latina, Physical Culture Poses (No. 2);;;;;The Cricket on the Hearth
;;;;;;;;;;;Paris : chasseurs à cheval et spahis de l’escorte;;Latina, Physical Culture Poses (No. 1);;;;;The Wings
;;;;;;;;;;;Park V. Fernie at Musselburgh;;Jim Jeffries on His California Ranch;;;;;Old Wives for New
;;;;;;;;;;;Girls Swinging;;Human Apes from the Orient;;;;;Le goûter des bébés
;;;;;;;;;;;Fire Drill;;The Anarchist's Mother-in-Law;;;;;Max Takes a Bath
;;;;;;;;;;;Photographic Convention of 1898;;Enkekejserinde Dagmars Ankomst;;;;;San Francisco Earthquake & Fire: April 18, 1906
;;;;;;;;;;;Alexandria Consulate;;Orfeus og Eurydike;;;;;The Enchanted Sedan Chair
;;;;;;;;;;;Annabelle Sun Dance;;Christian IXS bisættelse;;;;;Market Day in Bitola
;;;;;;;;;;;The Mischievous Monkey;;Holger Drachmann;;;;;Turkish Professor at the Agricultural School
;;;;;;;;;;;Les Aïnos à Yeso, [II];;The Pigeon Fairy;;;;;Hyde Park Corner
;;;;;;;;;;;Les Aïnos à Yeso, [I];;The Joe Gans-Battling Nelson Fight;;;;;In the Bogie Man's Cave
;;;;;;;;;;;Danseuses japonaises : la danse des ombrelles;;L'Obsession de l'or;;;;;The Last Drop of Water
;;;;;;;;;;;Procession shintoïste;;Anna, what are you waiting for?;;;;;Dragoons Crossing the Sâone
;;;;;;;;;;;Un pont à Kyoto;;Living Flowers;;;;;Two Fencers
;;;;;;;;;;;Yokohama : déchargement dans un port;;The Invisible Men;;;;;Cock Fight, No. 2
;;;;;;;;;;;Dîner japonais;;Voyage autour d'une étoile;;;;;In the Land of the Head Hunters
;;;;;;;;;;;Chutes du Rhin vues de près;;Electric Current;;;;;Sightseeing Through Whisky
;;;;;;;;;;;Procession, I;;Society Ballooning, Pittsfield, Mass.;;;;;London Street Dancers
;;;;;;;;;;;Pont sur le Rhin;;San Francisco Disaster;;;;;Down the Hudson
;;;;;;;;;;;Bersagliers;;Skyscrapers;;;;;Miniature Theatre
;;;;;;;;;;;Görlitz : revue devant Guillaume II et Nicolas II;;Arrival of Emigrants, Ellis Island;;;;;The Kiss
;;;;;;;;;;;Guillaume II et Nicolas II à cheval;;The Great Jewel Mystery;;;;;Come Along, Do!
;;;;;;;;;;;III. Défilé de hussards devant Guillaume II;;A Trip to Salt Lake City;;;;;Pay Your Dues
;;;;;;;;;;;I. Avant l'inauguration. Arrivée des souverains;;Departure of Peary and the Roosevelt from New York;;;;;Hearts and Flowers
;;;;;;;;;;;Pierrot et la mouche;;Pennsylvania Tunnel Excavation;;;;;The Hairdresser
;;;;;;;;;;;Jongleur au ballon;;Bargain Day, 14th Street, New York;;;;;Pont de Westminster
;;;;;;;;;;;Un prêté pour un rendu;;Hippodrome Races, Dreamland, Coney Island;;;;;Wallachian Dance
;;;;;;;;;;;Discussion;;The Boarding School Girls;;;;;The Exploits of Elaine
;;;;;;;;;;;Arroseur et arrosé, II;;Lovely Bohemians;;;;;The Attempt Against the Life of Maitre Labori
;;;;;;;;;;;Serpent;;Le Moustique Récalcitrant;;;;;The Face at the Window
;;;;;;;;;;;Amsterdams vreemdelingenverkeer;;Danse de l'éventail;;;;;The Children in the House
;;;;;;;;;;;After the Children's Fair in the Circus Carré, 13 September;;Dial's Girl's Band, Luna Park;;;;;Thieves' Gold
;;;;;;;;;;;Watersnood in buurt YY;;The Dog Outwits the Kidnapper;;;;;Moscow Clad in Snow
;;;;;;;;;;;De weeshuis-quaestie;;The Long Arm of the Law;;;;;Broncho Billy and the Land Grabber
;;;;;;;;;;;Een trambestorming op zondag op den dam;;The Boutdebois Brothers;;;;;A Daughter of France
;;;;;;;;;;;Bath Scene;;Little Tich;;;;;The Battle Hymn of the Republic
;;;;;;;;;;;Le chat qui joue;;Woman Draped in Patterned Handkerchiefs;;;;;From Broadway to a Throne
;;;;;;;;;;;Une partie de lawn-tennis, I;;The Roller Skate Craze;;;;;Sin
;;;;;;;;;;;La Bourse;;The Cigar Box;;;;;Onésime Gets Married... So Does Calino
;;;;;;;;;;;Sortie d'usine, [III];;Japanese Butterflies;;;;;Sauce for the Goose
;;;;;;;;;;;Sortie d'usine, [IV];;Buon anno!;;;;;Every Inch a Man
;;;;;;;;;;;Sardine fishing;;In the Land of the Gold Mines;;;;;The Ranchman's Vengeance
;;;;;;;;;;;Pêcheurs raccommodant les filets;;The Fairies and the Faun;;;;;The Flying Torpedo
;;;;;;;;;;;Marché;;The Blue Bird;;;;;Lutteurs japonais
;;;;;;;;;;;Leçon de bicyclette;;The Black Witch;;;;;The Bell Ringer's Daughter
;;;;;;;;;;;Enfant et chien;;Cinderella;;;;;Othello
;;;;;;;;;;;Abattage d'un arbre;;The Fairy of Spring;;;;;Love and Journalism
;;;;;;;;;;;Biarritz : la plage et la mer;;The Wonderful Album;;;;;Kansas Saloon Smashers
;;;;;;;;;;;Biarritz : le Port-Vieux;;The Hen That Laid the Golden Eggs;;;;;Budapest, pont suspendu
;;;;;;;;;;;Biarritz : une rue;;Policemen as We Portray Them / Policemen as They Are;;;;;Undressing Extraordinary
;;;;;;;;;;;Pau : la place du marché;;Dr. Isnardi: Amputation;;;;;The Candy Kid
;;;;;;;;;;;Cauterets : défilé, II;;Lady Helen's Escapade;;;;;Addition and Subtraction
;;;;;;;;;;;Cauterets : défilé, I;;Sideshow Wrestlers;;;;;Her Friend the Bandit
;;;;;;;;;;;Panorama de la ligne de Cauterets, II;;Sleeping Beauty;;;;;Over the Fence
;;;;;;;;;;;Panorama de la ligne de Cauterets, I;;The Woes of Roller Skaters;;;;;The House of Hate
;;;;;;;;;;;Défilé du club républicain James Blaine;;Modern Sculptors;;;;;Feeding the Doves
;;;;;;;;;;;Défilé de l'artillerie du district de Columbia;;The Vacuum Cleaner;;;;;Peggy
;;;;;;;;;;;Executive Mansion;;Why That Actor Was Late;;;;;Liverpool, panorama pris du chemin de fer électrique, I
;;;;;;;;;;;Visite de Leurs Majestés à la mine de fer;;A Very Fine Lady;;;;;Scandal
;;;;;;;;;;;Défilé des vétérans en costumes anciens : I. Vue de loin;;The Genii of Fire;;;;;Betsy's Burglar
;;;;;;;;;;;Défilé des bersagliers;;Fireside Reminiscences;;;;;Place du Pont
;;;;;;;;;;;Défilé de l'infanterie;;Cupid’s Pranks;;;;;The Terrible Turkish Executioner
;;;;;;;;;;;Arrivée du roi et de son état-major;;In a Difficult Position;;;;;Evian : procession de la Fête-Dieu I
;;;;;;;;;;;Roi d'Italie et prince Victor passant la revue;;Donnerwetter, tadellos;;;;;The Redman's View
;;;;;;;;;;;Arrivée d'un train à Melbourne;;Father Gets in the Game;;;;;Salome
;;;;;;;;;;;La Course;;At the French Ball;;;;;A Victim of Circumstance
;;;;;;;;;;;Enceinte du pesage;;The Bank Robbery;;;;;A Sawmill Hazard
;;;;;;;;;;;Arrivée du gouverneur;;Beginning of the Serpentine Dance;;;;;The Eternal Question
;;;;;;;;;;;La Foule;;French Cops Learning English;;;;;A Vitagraph Romance
;;;;;;;;;;;Inauguration du monument de Victor-Emmanuel à Sassari;;The Bee and the Rose;;;;;Love Everlasting
;;;;;;;;;;;Cuirassés de l'escadre italienne;;Love that Kills;;;;;Dr. Jekyll and Mr. Hyde
;;;;;;;;;;;Cuirassés de l'escadre française sur les côtes de Sardaigne;;Whimsical People;;;;;The Crow
;;;;;;;;;;;Station du chemin de fer de Tokyo;;At the Crossroads of Life;;;;;Men of the Desert
;;;;;;;;;;;Une avenue à Tokyo;;Tramway;;;;;Kampen om Kvinden
;;;;;;;;;;;Une rue à Tokyo, [II];;The Miser;;;;;The Moth
;;;;;;;;;;;Spain: Bullfighting;;The New Lord of the Village;;;;;The Human Pyramid
;;;;;;;;;;;Le prince et la princesse de Naples;;The Tempest;;;;;Chaise en bascule
;;;;;;;;;;;6ème bataillon de chasseurs alpins: ascension du sommet du diable;;Romance of a Jewess;;;;;Bicycle Trick Riding, No. 2
;;;;;;;;;;;La cène;;The Mischance of a Photographer;;;;;The Invaders
;;;;;;;;;;;New York, Avenue et Union Square;;A Calamitous Elopement;;;;;The Charge of the Light Brigade
;;;;;;;;;;;Une rue à Séville;;The Good Shepherdess and the Evil Princess;;;;;Father Sergius
;;;;;;;;;;;Acteurs japonais : bataille au sabre;;The Knight of Black Art;;;;;The Landing of Savage South Africa at Southampton
;;;;;;;;;;;Panorama pris en chemin de fer, départ de Dammurey;;Drama at the Puppets' House;;;;;The Death of the Duke D'Enghien
;;;;;;;;;;;Bal des Sablaises;;Not Guilty;;;;;Robin Hood
;;;;;;;;;;;Voyage de M. le Président Félix Faure en Russie (Août 1897): Arrivée du président et du Czar à Peterhof;;A Tricky Painter’s Fate;;;;;A Wasted Sacrifice
;;;;;;;;;;;Lourdes, procession, I;;Scullion's Dream;;;;;A Cure for Pokeritis
;;;;;;;;;;;Embarquement pour la promenade;;The Prophetess of Thebes;;;;;Shoes
;;;;;;;;;;;Panorama pris depuis une plate-forme mobile;;Oh How Deceptive;;;;;Leading Lizzie Astray
;;;;;;;;;;;Le président en promenade;;Buncoed Stage Johnnie;;;;;Flirting with Fate
;;;;;;;;;;;The Arrival of the King of Siam in Stockholm;;Tale the Autumn Leaves Told;;;;;Home, Sweet Home
;;;;;;;;;;;Parade of Buffalo Bill's Wild West Show, No. 2;;St. Kilda, Its People and Birds;;;;;Mexico, Spanish Street Dance
;;;;;;;;;;;A West Indian Woman Bathing a Baby;;Fish Factory at Astrakhan;;;;;The Man from Painted Post
;;;;;;;;;;;Buffalo Bill;;Female Conscripts;;;;;Where Is My Treasure?
;;;;;;;;;;;A Panorama of Indian Scenes & Procession;;The Vain Parlor Maid;;;;;Spain
;;;;;;;;;;;Two People at Dojo temple;;The Power of Hypnosis;;;;;The Dream Lady
;;;;;;;;;;;The German Emperor Reviewing His Troops;;Preparation for the Rendezvous;;;;;Execution of Czolgosz with Panorama of Auburn Prison
;;;;;;;;;;;Tsar et tsarine entrant dans l'église de l'Assomption;;The Magic of the Mandarin;;;;;Traffic in King's Road, Chelsea
;;;;;;;;;;;Chicken Thieves;;Robert Macaire and Bertrand;;;;;A Lady and Her Maid
;;;;;;;;;;;A Bicycle Trip Through Europe;;How Bridget's Lover Escaped;;;;;Love and War
;;;;;;;;;;;Arab Knife Grinder at Work;;Laughing Gas;;;;;The Little Match Seller
;;;;;;;;;;;Dancing Darkies;;The Talisman;;;;;The Airship Destroyer
;;;;;;;;;;;"Performing Animals; or, Skipping Dogs";;First Prize in Cello;;;;;The Warrior
;;;;;;;;;;;"Boxing Match; or, Glove Contest";;Rogues' Tricks;;;;;Tom Sawyer
;;;;;;;;;;;Landing at Low Tide;;The Colonel's Account;;;;;Turks' Hearing Speech on Hürriyet
;;;;;;;;;;;Sortie d'une noce à l'église;;La terroriste;;;;;The Spider and the Butterfly
;;;;;;;;;;;Arrivée en gondole des souverains d'Allemagne et d'Italie au palais royal de Venise;;Cohen’s Fire Sale;;;;;Alice's Adventures in Wonderland
;;;;;;;;;;;Cock Fight;;The Trainer’s Daughter, or A Race for Love;;;;;Le vieux Paris: Vue prise en bateau
;;;;;;;;;;;Pau : la terrasse;;Fights of Nations;;;;;Elephants Shooting the Chutes at Luna Park
;;;;;;;;;;;Paris : les souverains russes et le président de la République aux Champs-Élysées;;College Chums;;;;;The Cord of Life
;;;;;;;;;;;Les krémos: Pyramide;;Easter Eggs;;;;;Shulamith
;;;;;;;;;;;Pompiers : mise en batterie;;His First Cigar;;;;;Twice Lived
;;;;;;;;;;;Distributing a War Extra;;Wonderful Mirrors;;;;;Charley on the Farm
;;;;;;;;;;;Kanakas Diving for Money (Honolulu), No. 2;;The Yawner;;;;;Padre
;;;;;;;;;;;Street Fight and Arrest;;Harlequin's Story;;;;;His First Ride
;;;;;;;;;;;Pie Eating Contest;;La Marseillaise;;;;;A Duet
;;;;;;;;;;;Badescener fra Skovshoved;;Trial Marriages;;;;;Asesinato y entierro de Don José de Canalejas
;;;;;;;;;;;Svanerne i Sortedamssøen;;The Tulips;;;;;Fate's Turning
;;;;;;;;;;;Her First Cigarette;;Bathing Forbidden;;;;;Her Painted Hero
;;;;;;;;;;;Governor Roosevelt and Staff;;Veil Dance;;;;;Hello, Mabel
;;;;;;;;;;;Parke Davis' Employees;;The Angler;;;;;Alas and Alack
;;;;;;;;;;;The Dandy Fifth;;The Abduction of the Slave Women;;;;;Carmaux: Drawing Out the Coke
