Griffith;Feuillade;Bauer;Sjostrom;Chaplin;Weber;Guy;Western;Terror;Scifi;Animacion;Origenes1;Origenes2;Origenes3;Italia;Dinamarca;Alemania;IGM;Todas
;;;;;;;The Sheriff;;;;Danse japonaise, II : Harusame;Massacre of the Christians by the Chinese;Au pays des pêcheurs;;;In the Bath;;The Honor of the Humble
;;;;;;;The Sheriff's Mistake;;;;Danse japonaise, I : Kappore;Weary Willie and Tired Tim: The Gunpowder Plot;Course de taureaux à Nîmes;;;Exciting Reading;;The False Bride
;;;;;;;The Bank Cashier;;;;Baignade de négrillons;Life of an English Fireman;Le bon écraseur;;;Fütterung von Riesenschlangen;;Hello Teacher
;;;;;;;The Desert Rat;;;;Battle of the flowers and float parade, III;Soldiers of the Cross;Mireille;;;A Match Box Mystery;;Anne of the Golden Heart
;;;;;;;The Wilderness Trail;;;;Battle of the flowers and float parade, II;Attack on a Russian Outpost;Tartarin de Toulouse;;;Auch Faulheit kann von Nutzen sein;;Justinian and Theodora
;;;;;;;The Ranger of Lonesome Gulch;;;;Battle of the flowers and float parade, I;The Good Purge;Un coup de vent;;;Ein neuer Erwerbszweig;;Prolog aus Bajazzo
;;;;;;;The Quagmire;;;;Lourdes, transporting the sick, I;Panoramic View of the White Pass Railroad;Von Stufe zu Stufe;;;Das andere Ich;;The Actress and the Singer
;;;;;;;The Girl from Frisco;;;;Lourdes, leaving the Church of the Rosary;Serpentine Dance;Une Famille nombreuse;;;Where Is Coletti?;;Jones and His New Neighbors
;;;;;;;Fighting Mad;;;;Lourdes, procession, III;Mustard Footbath;Les deux espiègles;;;The Arc;;Krigskorrespondenter
;;;;;;;Just Squaw;;;;Lourdes, procession, II;The Triple Headed Lady;Mariez-vous donc;;;The Picture of Dorian Gray;;Mrs. Leffingwell's Boots
;;;;;;;A Drama on a Locomotive;;;;Le président prenant congé de ses ministres;Feu d'artifice;Pussy's Breakfast;;;The Latest Star from Vaudeville;;The Maid from Sweden
;;;;;;;The Devil Dodger;;;;Marché;Fontaine Lumineuse a Versailles;Good Evening, the Flower Fairy;;;Frontstairs and Backstairs;;John T. Rocks and the Flivver
;;;;;;;The Deserter;;;;Espagne : courses de taureaux, II;Au pays des glaces;Noisy Neighbors;;;Das Lied der Colombine;;Mechta i zhizn
;;;;;;;The Westerners;;;;Elephants;Bateaux sur le Nil;Firefighting Exercise;;;The Checkered Raincoat;;Whose Wife?
;;;;;;;Squatters Rights;;;;Colin-maillard au baquet;Une indigestion;L'institut de beauté;;;Ein neuer Dreibund;;Intercalated Games
;;;;;;;The Money Corral;;;;L'assiette au noir;Kent House Slide;Les femmes chauffeuses;;;Hann, Hein und Henny;;La porteuse de pain
;;;;;;;The Secret of Death Valley;;;;Sortie d’un temple shintoïste;L'homme aux cent trucs;Wonderful Flames;;;Deutsche Helden;;Trilby
;;;;;;;An Adventure on the Mexican Border;;;;Danseuses japonaises : la danse des éventails;The Fairy of the Stars;Danses andalouses;;;S1;;Die Nacht des Grauens
;;;;;;;The Ranchman's Daughter;;;;Acteurs japonais : danse d’homme;Algerian Dances;Christy Mathewson and the New York National League Team;;;The Pleasures of the Reserve Exercise;;Chimmie Fadden Out West
;;;;;;;Mr. 'Silent' Haskins;;;;Une scène au théâtre japonais;Comic Pictures in High Street, West Bromwich;The Warwick Pageant;;;When Nations Quarrel;;L'étoile du génie
;;;;;;;Well, I'll Be;;;;Arrivée d’un train à Nagoya;Grandpa's Reading Glass;The Secret of Death Valley;;;The Shylock of Kraków;;In the Aisles of the Wild
;;;;;;;Parson Sue;;;;La fanfare des Sables;Drama in the Air;Victime des créanciers;;;Specter of the Sea;;Lebenswogen
;;;;;;;A Sister of Six;;;;Arrivée en voiture à la gare;The Porter's Horrible End;Une femme trop pressée;;;Das rosa Pantöffelchen;;The Red Glove
;;;;;;;Border Raiders;;;;Embarquement de M. le président au départ de l’Ile de Ré;Puss In Boots;The Regret;;;Roping Big Game in the Frozen North;;Her Nature Dance
;;;;;;;The Spirit of Cabin Mine;;;;Arrivée de M. le président à Sainte-Marie;Grand Display of Brock's Fireworks at the Crystal Palace;The Good Judge;;;Ossis Tagebuch;;Cunégonde fait du spiritisme
;;;;;;;South o' Santa Fe;;;;Réception à La Flotte;Happy Hooligan Interferes;Le billet de logement;;;Madeleine;;Le due seduzioni
;;;;;;;Letters of Fire;;;;Ré : débarquement de M. le président;Leap Frog;La vengeance du clerc de notaire;;;The Highway;;Gesprengte Ketten
;;;;;;;Leave It to Susan;;;;Panorama du port;Coasting Scene at Montmorency Falls, Canada;La chaussette;;;Her Sergeant;;The Amazing Impostor
;;;;;;;When the Tables Turned;;;;Saintes : remise de décorations;Railroad Smashup;Kongebesøg i Aarhus 1906;;;Gendarm Möbius;;Accession of the Romanov Dynasty
;;;;;;;During the Round-Up;;;;Cortège de M. le président sortant de la gare;Washing Gold on 20 Above Hunker, Klondike;Douaniers et fraudeurs;;;The Golem and the Dancing Girl;;The Alien Blood
;;;;;;;Tennessee's Pardner;;;;M. le président à l’hôpital militaire écoutant le compliment d’une petite fille;Automobile Parade on the Coney Island Boulevard;Douanier séduit;;;Tales of Hoffmann;;The Squatter's Daughter
;;;;;;;The Last of the Duanes;;;;Arrivée de M. le président dans l’arsenal;A View Taken from a Mobile Platform I;Opération chirurgicale;;;Hansa;;The Dormant Power
;;;;;;;Kidnapping by Indians;;;;Panorama de l’arsenal;The Battleship 'Odin';The Language of Flowers;;;Die schwarze Natter;;The Rescue
;;;;;;;Her Atonement;;;;Arrivée de l’Elan;Fulton Market;L'assassinat du grand-duc Serge;;;The Tooth Devil;;With Our King and Queen Through India
;;;;;;;Put up Your Hands;;;;M. le président arrivant au bal des Sablaises;Film trichrome;La perruque;;;Der Feind hört mit;;The Prince's Daughter
;;;;;;;In the Sage Brush Country;;;;Débarquement des Sablaises;Rudge and Whitworth, Britain's Best Bicycle;Duel Scene from Macbeth;;;Durchlaucht amüsiert sich;;The Frontiers of the Heart
;;;;;;;The Man from Nowhere;;;;Débarquement de M. le président au Carnet;Cunard Mail Steamer Lucania Leaving for America;Déménagement à la cloche de bois;;;A Coin the Colour of Battle Field Grey;;Alcohol
;;;;;;;Bull Arizona;;;;Le président après l’inauguration du monument de Paul Baudry;S.S Saxonia in Liverpool;Au jardin zoologique de Paris;;;The Diary of Dr. Hart;;Under the Yoke
;;;;;;;Truthful Tulliver;;;;Le président arrivant à l’inauguration du monument de Paul Baudry;The Finish of Bridget McKeen;Matrimonial Agency;;;The Sun's Revenge;;The Bandit King
;;;;;;;Riddle Gawne;;;;Train présidentiel;Capture of the Biddle Brothers;The Imager of Mont Saint-Michel;;;Tyrol in Arms;;How Plimps and Plumps Fooled the Detective
;;;;;;;Selfish Yates;;;;Comtesse de Montebello;Gabriel Grub the Surly Sexton;Patrician and the Slave;;;Storm Sign;;A Rich Revenge
;;;;;;;Chip of the Flying U;;;;Rome, Piazza Colonna;Race for the Grand National;Barrack Blossoms;;;Spiritismus;;The Death of Saul
;;;;;;;The Great Divide;;;;Rome, fin du cortège au mariage du prince de Naples;Bloodhounds Tracking a Convict;A Difficult Problem;;;Donnerwetter, tadellos;;Branding Broadway
;;;;;;;Where the West Begins;;;;Combat sur la voie ferrée;Oxford and Cambridge Boat Race 1901;There is a Barrel and a Barrel;;;Female Conscripts;;Martyrs of the Inquisition
;;;;;;;A Sage Brush Hamlet;;;;Débarquement et feu de mousqueterie;The Derby 1900;Frau Holle;;;The Vain Parlor Maid;;Across the Mexican Line
;;;;;;;A Man and His Mate;;;;Branle-bas de combat;The Football Final;The Emigrant;;;The Power of Hypnosis;;How I Was Murdered
;;;;;;;Under Handicap;;;;Régates (retour);Cyclists and Pony Traps;The Shipwreck;;;The Magic of the Mandarin;;Onésime's Family Drama
;;;;;;;The Trail To Yesterday;;;;Régates (aller);Firing at the Ranges;The Buoy;;;Bathing Forbidden;;Let's Go
;;;;;;;The Quitter;;;;Arrivée d’un bateau et mise à l’ancre;Phantom Ride, Chamonix;Charitable Childhood;;;The Angler;;La vie cosmopolite au Caire
;;;;;;;The Sleeping Lion;;;;Défilé de l’artillerie de marine;The Bout;A Restless Night;;;The Abduction of the Slave Women;;I parassiti della rana
;;;;;;;Winner Takes All;;;;Défilé de la compagnie de débarquement, II;The Training of Infantry;The Beggar's Christmas;;;The Slave Market;;Ascension to the Giant's Tooth
;;;;;;;Rosalind at Redgate;;;;Défilé de la compagnie de débarquement, I;Training at the Regimental Depot;Remember Remember the Fifth of November;;;The Sculptor's Dream;;Training Cavalry Horses: The Recruit's First Ride
;;;;;;;Hungry Eyes;;;;Embarquement d’un boeuf;The Deserter;A New Hat for the Madam;;;A Modern Marriage;;Paris : dragons de l’escorte
;;;;;;;Pay Me!;;;;Lavage du pont, II;The Launch of HMS Dominion;The Standing Cock;;;Der Jongleur;;Bébé soigné son père
;;;;;;;Follow the Girl;;;;Essuyage du pont;Workforce of Scott & Co. Shipyard, Greenock;What is a flag?;;;Italienischer Bauerntanz;;A léleklátó sugár
;;;;;;;The Fighting Gringo;;;;Lavage du pont, I;Employees Leaving Messrs Vickers and Maxim's in Barrow;In a Bamboo Hut;;;A Funny Story at the Window;;The Cloth Peddler
;;;;;;;Mixed Blood;;;;Défilé d’inspection à bord des artilleurs et torpilleurs mineurs;Réception de sa majesté Alphonse XIII à Barcelone;The Tinderbox;;;The Family Doctor;;The Fleet and Allied Armies at Thessaloniki
;;;;;;;The Yaqui;;;;Défilé d’inspection à bord de la compagnie de débarquement;A Touching Pleading;A Disastrous Flirtation;;;The Mysterious Club;;Idyllic Farm
;;;;;;;A Knight of the Range;;;;Salut aux couleurs;Phenomenal Hen;Tunis;;;Hurra! Einquartierung!;;La Vie de Bohème
;;;;;;;Colorado;;;;Remise des médailles de Madagascar;Disagreeable Mistake;A Day of Work at the Cavalry School;;;The Marsh Flower;;The Lurking Peril
;;;;;;;The Long Chance;;;;Départ des permissionnaires;Le jugement de Pâris;Satan's Defeat;;;The Film Prima Donna;;Colonel Theodore Roosevelt's Expedition Into the Wilds
;;;;;;;Riders of the Purple Sage;;;;Départ du canot major;A Fight with Sledgehammers;Mme. Croquemitaine;;;On a Lonely Island;;Where Hazel Met the Villain
;;;;;;;The Fighting Grin;;;;Embarquement des marins dans leurs canots;Maria Marten: or, The Murder at the Red Barn;Cretinetti cerca un duello;;;Der neue Schreibtisch;;In Defense of the Nation
;;;;;;;The Eagle;;;;L’amiral rentrant à bord;Fox Terriers and Rats;Falsely Accused;;;"The Black Ball; or, The Mysterious Sisters";;Past Redemption
;;;;;;;The Desire of the Moth;;;;"Le ""Carnot""";Indians and Cowboys;The Boy with the Sixth Sense;;;The Enchanted Circle;;Albert Quay in Cork
;;;;;;;A Stranger from Somewhere;;;;"Le ""Courbet""";The Fairy of the Black Rocks;Pranks;;;Der Perser;;As A Man Soweth
;;;;;;;A Life for a Kiss;;;;"Le ""Formidable""";In My Lady's Boudoir;The Blind Man's Daughter;;;Meyer from Berlin;;The Captive
;;;;;;;His Foothill Folly;;;;Les cuirassés de l’escadre (panorama);The Art of 'Making Up';Les Hommes sandwich;;;The Yellow Ticket;;Nero, or The Fall of Rome
;;;;;;;Hogan Out West;;;;Belfast, pompiers : exercices de sauvetage;"She Banked in Her Stocking; or, Robbed of Her All";The Scarlet Letter;;;Die Sühne;;The Forbidden City
;;;;;;;Courage of Sorts;;;;13e hussards : charge;St Helens V Swinton, 1901;A Sweet Revenge;;;Die Liebe der Maria Bonde;;The Hierarchies of Love
;;;;;;;Rider of the Law;;;;13e hussards : exercices du sabre, pied à terre et départ;Oddfellows Procession in St Helens;Wanted, a Child;;;Little Angel;;Just Neighbors
;;;;;;;The Ace of the Saddle;;;;13e hussards : arrivée et pied à terre;Operatives Leaving Messrs Pilkington Bros Works, St Helens 1901;Mrs. Jones Entertains;;;The Ancestress;;Out of the Inkwell
;;;;;;;The Outcasts of Poker Flat;;;;13e hussards : défilé par douze;Workers Leaving Gossage's Soap Works, Widnes;Don Juan de Serrallonga;;;Der Andere;;Poultry-Yard
;;;;;;;Two Men of the Desert;;;;13e hussards : défilé;Parade of Widnes School Children;Les grandes eaux de Versailles;;;The Queen of the Stock Exchange;;Retour d’une promenade en mer
;;;;;;;Marked Men;;;;13e hussards : saut d’obstacles par douze;Fire and Flames at Luna Park, Coney Island (An Attraction at Coney Island);Paper Manufacturing;;;The Traitress;;Algie, the Miner
;;;;;;;Wolves of the Rail;;;;Arrivée à Kingstown;The House That Jack Built;Desfile histórico del centenario;;;Wahnsinn;;Good Glue Sticks
;;;;;;;A Man in the Open;;;;Ligne de Belfast à Kingstown, III;The Bold Bank Robbery;Viernes de dolores;;;The Pride of the Firm;;Mazeppa, der Volksheld der Ukraine
;;;;;;;A Temporary Truce;;;;Ligne de Belfast à Kingstown, II;The Draped Model;Un día en Xochimilco;;;;;Kiri-Kis
;;;;;;;Chilean Soul;;;;Ligne de Belfast à Kingstown, I;Execution of a Spy;Niños en la alameda;;;;;Going Straight
;;;;;;;The Desert Man;;;;Soundy Mounts;Electrocution;Gira política de Madero y Pino Suárez;;;;;Bashful
;;;;;;;The Rose of the Rancho;;;;Lisburn;Kaiser Wilhelm arrival to Copenhagen 2.4;Fiesta de toros;;;;;A Christmas Carol
;;;;;;;Calamity Anne's Ward;;;;Départ de Dunmurry;Expérience du ballon dirigeable de M. Santos Dumont. II. Le ballon et son moteur;The Scream of Dolores, or The Independence of Mexico;;;;;East Lynne
;;;;;;;A Romance of the Western Hills;;;;Panorama du départ de Belfast;Next!;The Fatal Hand;;;;;Mary Jane's Mishap
;;;;;;;The Knickerbocker Buckaroo;;;;Panorama du palais de Westminster pris de la Tamise;A Total Accident;Ein Matrosenabenteuer in Hamburg;;;;;Adventures of William Tell
;;;;;;;The Girl of the Rancho;;;;Départ d’un bateau sur la Tamise;Ten Nights in a Barroom;Work Made Easy;;;;;Extraordinary Illusions
;;;;;;;Legal Advice;;;;Bateaux sur le lac de St-James Park;Nice: Panorama sur la ligne de Beaulieu à Monaco, III;The Great Breach;;;;;The Sunbeam
;;;;;;;Passing of the Oklahoma Outlaws;;;;Les dernières cartouches;Nice : panorama sur la ligne de Beaulieu à Monaco, II;The False Oath;;;;;Eleanor's Catch
;;;;;;;Two Men;;;;Signature du traité de Campo-Formio;Nice : le char des berceuses et de la chanson;Puss in Boots;;;;;Protéa
;;;;;;;Riders of Vengeance;;;;Faust : métamorphose de Faust et apparition de Marguerite;Biarritz : la plage et l'établissement;The Grateful Mice;;;;;Poor Jenny
;;;;;;;The Better Man;;;;Bataille d’enfants à coup d’oreillers;Les poupées;In the Golden Hollow;;;;;Friends
;;;;;;;Life on the Circle Ranch in California;;;;Une farce à la chambrée;Chirurgie mécanique;The Clay Industry in Sicily;;;;;Miss Dundee and Her Performing Dogs
;;;;;;;The Boss of the Lazy Y;;;;Scène chez l’antiquaire;Tentation de Saint-Antoine;Through Sicily;;;;;Just Rambling Along
;;;;;;;Hands Up!;;;;Chez le juge de paix;Le cambrioleur;Ride Through Vancouver, Canada;;;;;Fatty's Tintype Tangle
;;;;;;;Hearts and Saddles;;;;Napoléon et la sentinelle;Arlequin et Méphistophélès;Photographic Expressions;;;;;L'Homme Machine
;;;;;;;Gun Law;;;;Danseur russe;Une scène à l'octroi;The Balancing Act;;;;;An Impossible Balancing Feat
;;;;;;;Bare Fists;;;;Les boxeurs et le spectateur trop curieux puni;Le gendarme et les domestiques;Il Natale di Cretinetti;;;;;The Moonshine
;;;;;;;The Rustlers;;;;Nounou et soldats;Pierrot et la flûte enchantée;L’antre infernal;;;;;A Fantastical Meal
;;;;;;;Sandy Burke of the U-Bar-U;;;;Panorama de la ligne de Peterhof;Le prestidigitateur au café;The Star of Bethlehem;;;;;The Lily of Belgium
;;;;;;;In Northern Forests;;;;Revue de Krasnoïe Selo : pages;Substitutions;Viy;;;;;Dreams of Toyland
;;;;;;;Roping a Bride;;;;Revue de Krasnoïe Selo : infanterie;La marmite diabolique;The Village Fire Brigade;;;;;The Misfortunes of an Explorer
;;;;;;;Big Noise Hank;;;;Revue de Krasnoïe Selo : grenadiers;Le château hanté;The Maids' Strike;;;;;The Magic Book
;;;;;;;The Square Deal Man;;;;Revue de Krasnoïe Selo : artillerie de forteresse;Une place publique à Tokyo;Falsely Accused!;;;;;Caicedo (with Pole)
;;;;;;;Roped;;;;Revue de Krasnoïe Selo : cosaques;Old London Street Scenes;Au music-hall (At the Music Hall);;;;;Colleurs d'affiches
;;;;;;;The Girl of the Northern Woods;;;;Officiers russes attachés au président et journalistes;Boys Sliding;The Polite Lunatic;;;;;Apparitions
;;;;;;;Hell's Crater;;;;M. le président passant devant la compagnie d’honneur;Central High School, Calisthenics, Missouri Commission;Grängesberg;;;;;Bocal aux poissons-rouges
;;;;;;;Ashes of Hope;;;;Arrivée de M. le président à Saint-Pétersbourg;Parade of Characters (Asia in America) St. Louis Exposition;Falkenberg Market;;;;;Transformation by Hats
;;;;;;;Early Oklahoma;;;;Suite du cortège passant devant l’amiral Avellan;Typical Algerian 'Ouled Nails' Muslin Dance;Un attentat sur la voie ferrée;;;;;Fire Rescue Scene
;;;;;;;The Escape of Jim Dolan;;;;Arrivée de M. le président et du tsar à Peterhof;King Georg of Saxony in Chemnitz on 10.9.1902;In and Through China: China of the Present Day;;;;;New York: Broadway at Union Square
;;;;;;;A Woman's Fool;;;;Panorama de la ville pris d’un bateau;Midway of Charleston Exposition (South Carolina);Le nain détective;;;;;Snow White
;;;;;;;Two Little Rangers;;;;Anvers : arrivée en Bateau;Dewsbury v Manningham;La fille du faux-monnayeur;;;;;The Hoodlum
;;;;;;;The Signal Fire;;;;Gardes à pied : marche de front;Warrington v. St. Helens;Der Herzenknicker;;;;;The Night Before Christmas
;;;;;;;Broncho Billy's Narrow Escape;;;;Gardes à pied : exercices d’assouplissement;The Last Alarm;Die Macht des Walzers;;;;;Fatty's New Role
;;;;;;;A Bit of Blue Ribbon;;;;Gardes à pied : maniement d’armes;Le Roi Victor Emmanuel III se rendant au Sénat pour la cérémonie du Serment;L'agent gelé;;;;;'49–'17
;;;;;;;The Goddess of Lost Lake;;;;Gardes écossais à Hyde Park;Plate-forme mobile et train électrique;Taikoki judanme;;;;;The Marvelous Hen
;;;;;;;The Two Brothers;;;;Fête du jubilé de la reine d'Angleterre : le cortège, l’artillerie à cheval;Steam Whistle;The Girl Spy: An Incident of the Civil War;;;;;Idle Wives
;;;;;;;Sage Brush Tom;;;;Fête du jubilé de la reine d'Angleterre : le cortège, les cavaliers du Cap;Children in the Surf at Coney Island;Hulda's Lovers;;;;;The False Faces
;;;;;;;Pendaison à Jefferson City;;;;Fête du jubilé de la reine d'Angleterre : le cortège, l’artillerie de marine;Images of China;Way Down East;;;;;Opium
;;;;;;;Brother Bill;;;;Fête du jubilé de la reine d'Angleterre : le cortège, les gardes du corps et la musique des dragons;Tram Rides through Nottingham;Why Girls Leave Home;;;;;Mabel and Fatty's Wash Day
;;;;;;;Broncho Billy and the Rustler's Child;;;;Fête du jubilé de la reine d'Angleterre : le cortège, les ambassadeurs;The Dude and the Burglars;Richard III;;;;;The Musical Marvel
;;;;;;;Making a Man of Her;;;;Fête du jubilé de la reine d'Angleterre : la foule suivant le cortège;St George's Day Procession in Liverpool;Married for Millions;;;;;The Fall of Babylon
;;;;;;;Broncho Billy's Last Hold-Up;;;;Fête du jubilé de la reine d'Angleterre : Le cortège, les princes étrangers;Trafalgar Day in Liverpool;A Trip through Berlin;;;;;Rube and Mandy at Coney Island
;;;;;;;The Post Telegrapher;;;;Le Caire, défilé de l’infanterie;Arrest of Goudie;A Pretty Dutch Town;;;;;Panorama from Top of a Moving Train
;;;;;;;The Cowboy and the Schoolmarm;;;;Damas, Souk-el-Fakhra;Liverpool Church Parade and Inspection;The Enchantress;;;;;A Trap for Santa Claus
;;;;;;;The Girl of the Golden West;;;;Damas, une place;Liverpool As Seen from the Front of an Electric Car from the Pierhead to the Circus;Drama in Moscow;;;;;The Usurer
;;;;;;;An Arizona Wooing;;;;Beyrouth, Souk-Abou-el-Nassahr;Liverpool Street Scenes;For the Term of His Natural Life;;;;;Admiral Cigarette
;;;;;;;Local Color on the A-1 Ranch;;;;Jérusalem : la voie douloureuse;Danses cosmopolites à transformation;Le vainqueur de la course pédestre;;;;;New York, descente des voyageurs du pont de Brooklyn
;;;;;;;Tools of Providence;;;;Jérusalem : Porte de Jaffa, côté ouest;West Indian Girls in Native Dance;Le Violon;;;;;The Obsession
;;;;;;;Broncho Billy's Capture;;;;Jaffa : panorama en chemin de fer (collines);Grand Review;Robbery Under Arms;;;;;Panorama de l’arrivée à Aix-les-Bains pris du train (temps de neige)
;;;;;;;A Girl of the West;;;;Jaffa : panorama en chemin de fer;Bucking Broncos;Choosing the Wallpaper;;;;;Rip's Dream
;;;;;;;A Wife of the Hills;;;;Jaffa : débarquement d’une barque;The Unclean World;Cake Walk, Performed by Nouveau Cirque;;;;;The Love Tragedy of the Homunculus
;;;;;;;The Abernathy Kids' Rescue;;;;Jaffa : Marché, III;Splendid New Views of Bombay;Nature's Fairest;;;;;Prussian Culture
;;;;;;;Bad Buck of Santa Ynez;;;;Jaffa : Marché, II;Raid on a Coiner's Den;International Contest for the Heavyweight Championship: Squires vs. Burns, Ocean View, Cal., July 4th, 1907;;;;;The Perils of Pauline
;;;;;;;The Disciple;;;;Jaffa : arrivée d’un train;Photographing a Female Crook;The Incendiary;;;;;King John
;;;;;;;Across the Pacific;;;;Panorama des rives du Nil, [VIII];The Grebel's Floating Nests;Un drame en mer;;;;;Je Vous Aime
;;;;;;;When the West Was Young;;;;Panorama des rives du Nil, [VI];The 'Gator and the Pickaninny;The Gypsy;;;;;Panorama pendant l'ascension de la Tour Eiffel
;;;;;;;A Frontier Hero;;;;Panorama des rives du Nil, [V];Épopée napoléonienne - Napoléon Bonaparte;The Gypsy;;;;;Défilé de voitures de bébés à la pouponnière de Paris
;;;;;;;The Cowboy Millionaire;;;;Panorama des rives du Nil, [IV];The Strike;Mysterious Villa;;;;;The Christmas Dream
;;;;;;;The Tiger Man;;;;Panorama des rives du Nil, [III];Don Quichotte;A Visit to the Champagne Factory Mercier;;;;;Getting Mary Married
;;;;;;;Broncho Billy's Christmas Dinner;;;;Panorama des rives du Nil, [II];La Vie d'un joueur;Flower Parade 1906;;;;;The Violin Maker of Cremona
;;;;;;;The Life of a Cowboy;;;;Départ de Toukh;A Political Discussion;Chaussure trop étroite;;;;;The Magician from Arabia
;;;;;;;The Girl and the Outlaw;;;;Départ de Benha;The Illusionist;Cavalcade;;;;;Pan-American Exposition by Night
;;;;;;;The Stage Rustler;;;;Départ du Caire;The Burning Barn;Dancing Procession at Echternach;;;;;The Departure of a Great Old Man
;;;;;;;The Kentuckian;;;;Village de Sakkarah (cavaliers sur ânes);L'assassinat du ministre Plehve;Leben und Treiben auf dem Viehmarkt;;;;;Wild and Woolly
;;;;;;;Treat 'Em Rough;;;;Le Caire, Kasr-el-Nil;Panorama of Ealing from a Moving Tram;Impressions of Trier;;;;;Native Women Coaling a Ship at St. Thomas, D.W.I.
;;;;;;;The Masked Rider;;;;Le Caire, sortie du pont de Kasr-el-Nil;Retour du Cortège après le Couronnement: Le Roi;The Corpus Christi Procession in Trier;;;;;The Lost Battalion
;;;;;;;Poker at Dawson City;;;;Le Caire, sortie du pont de Kasr-el-Nil (chameaux);Rocking Gold in the Klondike;Domausgang am Ostersonntag;;;;;The War and the Dream of Momi
;;;;;;;Salomy Jane;;;;Le Caire, pont de Kasr-el-Nil;Love by the Light of the Moon;The Sheep Stealer;;;;;The Funeral of Metropolitan Emilianos of Silyvria
;;;;;;;The Law and the Outlaw;;;;Le Caire, rue Tath-el-Rab’;Women of the Ghetto Bathing;Naval Attack on Portsmouth;;;;;Cinderella or The Glass Slipper
;;;;;;;The Jaws of Justice;;;;Le Caire, rue Sharia-el-Nahassine;Lancaster, Pa., High School;Empire State Express, the Second, Taking Water on the Fly;;;;;Avenue de l'Opéra
;;;;;;;Entrada de Villa y Zapata a la Ciudad de México;;;;Le Caire, rue Ataba-el-Khadra;Revue à Longchamp : défilé de la Garde Républicaine et des pompiers;A Seaside Girl;;;;;The Undesirable
;;;;;;;Funeral de Emiliano Zapata;;;;Le Caire, rue Sayeda-Zeinab;The Living Picture;On a Good Old 5¢ Trolley Ride;;;;;Shooting the Chutes
;;;;;;;Over Silent Paths;;;;Le Caire, Place Soliman Pacha;Kingston Rowing Club at Practice;A Christmas Carol;;;;;Ten Ladies in an Umbrella
;;;;;;;Rough-Riding Romance;;;;Le Caire : Place de l'Opéra;Indsejlingen til Warnemünde 1903;A Dreadful Night;;;;;Lyon : débarquement d'une mouche
;;;;;;;Mr. Logan, U.S.A.;;;;Le Caire, Place du Gouvernement;Seashore Frolics;Une Partie de Tandem;;;;;The Virginian
;;;;;;;Baree, Son of Kazan;;;;Le Caire, Place de la Citadelle;Run of N.Y. Fire Department;Mystic Shriners' Day, Dreamland, Coney Island;;;;;National Red Cross Pageant
;;;;;;;Cupid's Round Up;;;;Bédouins avec chameaux sortant de l’octroi;President Roosevelt's Homecoming;Dixon-Wanamaker Expedition to Crow Agency;;;;;The Cry of the Children
;;;;;;;Western Blood;;;;Place Méhémet Ali;A Phenomenal Contortionist;The Death of Ivan the Terrible;;;;;Spring: Episode 1 - The Awakening of the Source / The Awakening of Nests
;;;;;;;Hopi Indians Dance for Theodore Roosevelt at [Walpi, Ariz.] 1913;;;;Embarquement;Parade of the Women Delegates, World's Fair;Jamestown Exposition;;;;;The Microscopic Dancer
;;;;;;;The Last Outlaw;;;;Arrivée du train de Ramleh;Parade of Mystic Shriners, Luna Park, Coney Island;Chrysanthemums;;;;;Berlin: Panoptikum
;;;;;;;Haceldama, or The Price of Blood;;;;Le khédive et son escorte;Opening Ceremonies, New York Subway, October 27, 1904;Building and Operating a British Railway;;;;;The Glue
;;;;;;;'Blue Blazes' Rawden;;;;Niagara, les rapides;Madison Square, New York;En Chine - Voyage sur le canal impérial;;;;;The Beggar of Cawnpore
;;;;;;;The Sagebrusher;;;;Métropolitain;The Eighth Wonder;The Son of a Slave;;;;;Le bon invalide et les enfants
;;;;;;;The Darkening Trail;;;;New York, Broadway et Reade Street;Panoramic View Near Mt. Golden on the Canadian Pacific R. R.;The Children of Edward IV;;;;;The Man Without a Future
;;;;;;;The Law of the Range;;;;Chicago, Michigan avenue;Ribe Cathedral Inauguration;From Sabina, Italy;;;;;Roosevelt's Rough Riders
;;;;;;;Burning Heart: An Indian Tale;;;;Boston, Tremont row;Daniel Dalsgaards Kaffeforretning;Evangeline;;;;;The Dull Sword
;;;;;;;A Debtor to the Law;;;;Boston, Atlantic avenue;Craftsmans' Parade 1904;A Slave to Drink;;;;;Poor Mother
;;;;;;;The Red Man and the Child;;;;Boston, Market street;Artillery at Jægerspris;The Grandmother;;;;;Luke Does the Midway
