Griffith;Feuillade;Bauer;Sjostrom;Chaplin;Weber;Guy;Western;Terror;Scifi;Animacion;Origenes1;Origenes2;Origenes3;Italia;Dinamarca;Alemania;IGM;Todas
Intolerance: Love's Struggle Throughout the Ages;The Vampires or, The Arch Criminals of Paris;Twilight of a Woman's Soul;A Man There Was;The Cure;Suspense.;The Cabbage-Patch Fairy;The Great Train Robbery;Dante's Inferno;A Trip to the Moon;Fantasmagorie;Roundhay Garden Scene;The Life and Passion of Jesus Christ;Fantasmagorie;Cabiria;The White Slave Trade;The Student of Prague;Shoulder Arms;The Life and Passion of Jesus Christ
Broken Blossoms;Fantômas;After Death;The Outlaw and His Wife;The Immigrant;Tarzan of the Apes;Falling Leaves;Exit of Rip and the Dwarf;Frankenstein;The Impossible Voyage;Gertie the Dinosaur;The Sprinkler Sprinkled;A Trip to the Moon;A Corner in Wheat;Dante's Inferno;Atlantis;The Oyster Princess;J'accuse;A Trip to the Moon
The Birth of a Nation;Judex;The Dying Swan;Ingeborg Holm;The Rink;Where Are My Children?;The Consequences of Feminism;The Squaw Man;The Execution of Mary, Queen of Scots;Frankenstein;Sallie Gardner at a Gallop;The Arrival of a Train at La Ciotat;The Impossible Voyage;The Diabolic Tenant;Satan's Rhapsody;The Mysterious X;The Doll;The Battle of the Somme;Intolerance: Love's Struggle Throughout the Ages
The Musketeers of Pig Alley;The Christian Martyrs;For Happiness;Sons of Ingmar;One A.M.;Hypocrites;The Burglars;Billy Blazes, Esq.;The Haunted Castle;20,000 Leagues Under the Sea;Poor Pierrot;Workers Leaving the Lumière Factory;The Great Train Robbery;The Merry Frolics of Satan;The Capture of Roma;The Abyss;The Golem;The Lost Battalion;Broken Blossoms
A Corner in Wheat;Bout-de-Zan's Money-Box;The Seducer;The Monastery of Sendomir;A Dog's Life;Fate;Faust and Mephistopheles;The Battle at Elderbush Gulch;A Nightmare;The Conquest of the Pole;At the Dentist;The Cabbage-Patch Fairy;Alice in Wonderland;The Black Imp;Maciste la terreur des bandits;Vera;Harakiri;National Red Cross Pageant;The Birth of a Nation
True Heart Susie;The Daily Bread;Child of the Big City;Kiss of Death;The Tramp;Idle Wives;At the Hypnotist's;The Massacre;The Merry Frolics of Satan;A Trip to Mars;Little Nemo;The Four Troublesome Heads;Life of an American Fireman;The Haunted Hotel;Stronger than Sherlock Holmes;The President;I Don't Want to Be a Man;A.W.O.L.;Cabiria
The Girl and Her Trust;La porteuse de pain;A Life for a Life;The Gardener;The Adventurer;The Rosary;On the Barricade;Hell's Hinges;A Terrible Night;The '?' Motorist;The Cameraman's Revenge;Sallie Gardner at a Gallop;The Man with the Rubber Head;Mr. Jones Has a Card Party;Come Cretinetti paga i debiti;A Trip to Mars;Different from the Others;The Girl Who Stayed at Home;The Cure
Mr. Jones Has a Card Party;Under the Yoke;The 1002nd Ruse;The Girl from the Marsh Croft;A Day's Pleasure;Captain Courtesy;The Race for the Sausage;Out West;The Infernal Cauldron;The Mechanical Butcher;The Haunted Hotel;Poor Pierrot;The Kingdom of the Fairies;The House of Ghosts;The Fear of Zeppelins;A Deal with the Devil;The Spiders - The Golden Sea;The Unbeliever;The Impossible Voyage
Hearts of the World;Bébé soigné son père;Silent Witnesses;Children of the Streets;The Vagabond;Borrowed Clothes;A Story Well Spun;Back to God's Country;The House of Ghosts;The Madness of Dr. Tube;The House of Ghosts;Passage of Venus;The One-Man Band;The Assassination of the Duke de Guise;Attila;Har De ikke set Cecilie?;The Eyes of the Mummy;In the Hands of the Enemy;The Immigrant
The Lonely Villa;The Obsession;Children of the Age;The Price of Betrayal;Kid Auto Races at Venice;The Dumb Girl of Portici;Midwife to the Upper Class;Madame Bo-Peep;The Merry Skeleton;Excursion to the Moon;Autour d’une cabine;Annabelle Serpentine Dance;The Big Swallow;The Lonely Villa;La nuova cameriera è troppo bella;Bech Olsens og Poul Pons' brydekamp;Madame DuBarry;Le passeur de l'Yser;The Rink
Death's Marathon;Spring: Episode 1 - The Awakening of the Source / The Awakening of Nests;Nelly Raintseva;Bra flicka reder sig själv;Behind the Screen;Scandal;What Will People Say?;He Died and He Didn't;The Devil in a Convent;Long Distance Wireless Photography;The Sinking of the Lusitania;Baby's Meal;Going to Bed Under Difficulties;Dream of a Rarebit Fiend;Il Finto Storpio;Der var engang;Wintergartenprogramm;Till I Come Back to You;The Great Train Robbery
The Lonedale Operator;The Pumpkin Race;Kumiry;Prästen;Easy Street;Shoes;Across the Mexican Line;The Tattooed Arm;The Golem;A léleklátó sugár;How a Mosquito Operates;The Astronomer's Dream;Joan of Arc;The Story of the Kelly Gang;King Lear;Krigskorrespondenter;Shoe Palace Pinkus;Cheyenne's Pal;The White Slave Trade
Judith of Bethulia;The Roman Orgy;Nina;Högfjällets dotter;The Fireman;Even as You and I;The Hierarchies of Love;Indian Romeo and Juliet;Satan's Rhapsody;The Love Tragedy of the Homunculus;The Enchanted Drawing;Cinderella;The Black Imp;The Witch;The Fall of Troy;In Defense of the Nation;The Boxing Kangaroo;The Battle of the Ancre and Advance of the Tanks;Roundhay Garden Scene
The New York Hat;Bout-de-Zan et le crime au téléphone;Tears;Strejken;The Floorwalker;Saving the Family Name;Algie, the Miner;The Stage Driver's Daughter;The Monster;The Black Box;Humorous Phases of Funny Faces;The Execution of Mary, Queen of Scots;The Infernal Cauldron;20,000 Leagues Under the Sea;Assunta Spina;The Man Without a Future;The Eskimo Baby;The German Retreat and the Battle of Arras;One A.M.
In the Border States;The Andalusian Girl;Vozmezdiye;Therèse;Shoulder Arms;The Jew's Christmas;Miss Dundee and Her Performing Dogs;The Strike at the Little Jonny Mine;The X-Ray Fiend;An Over-Incubated Baby;The Magic Rosette;The Haunted Castle;The Fat and Lean Wrestling Match;The Dancing Pig;Le due seduzioni;Gorki, The Demon Detective;Ein Jagdausflug nach Berlin;Battle Front in Britain;The Sprinkler Sprinkled
The Mothering Heart;A Race for Millions;Koroleva ekrana;The Ships That Meet;The Pawnshop;Forbidden;Avenue de l'Opéra;The Tribe's Penalty;The Hallucinated Alchemist;Alraune;The Musician Monkey;The Conjurer;The Melomaniac;Whimsical Illusions;Ascension to the Giant's Tooth;The Henpecked Husband’s Birthday;Frauen, die nicht heiraten sollten;L'offensive française sur la Somme;A Dog's Life
An Unseen Enemy;The Agony of Byzantium;Chuzhaya dusha;The Governor's Daughters;A Night in the Show;The Troubadour's Triumph;The Glue;The Little Doctor of the Foothills;Bluebeard;A Trip to Mars;Bewitched Matches;The Kiss;The Mermaid;Ben Hur;Nero, or The Fall of Rome;Sct. Clemensbro i Aarhus;4628 meters high on skis - ascent of Monte Rosa;On the Jump;The Arrival of a Train at La Ciotat
Those Awful Hats;L'engrenage;Lina's Adventure in Sochi;Guilt Redeemed;Sunnyside;The People vs. John Doe;Pierrette's Escapades;Kit Carson's Wooing;The Sealed Room;Alraune and the Golem;The Faithful Furniture;Traffic Crossing Leeds Bridge;Electrocuting an Elephant;The Consequences of Feminism;The War and the Dream of Momi;The Ballet Dancer;Sein einziger Sohn;Functional-motor stimulus and paralysis in war participants and their healing through suggestion in hypnosis;The Tramp
The Sealed Room;Vendémiaire;Lina under Examination, or the Turbulent Corpse;Judge Not;Mabel at the Wheel;Fine Feathers;Dranem Performs The True Jiu-Jitsu;The Ranger's Romance;The Avenging Conscience;Alraune, die Henkerstochter, genannt die rote Hanne;The Dinosaur and the Missing Link: A Prehistoric Tragedy;The Vanishing Lady;Grandma's Reading Glass;Humorous Phases of Funny Faces;Nelly, the Tamer;Lion Hunting;Lola Montez;Transport of the U.T. Visitors' Christmas Warrior Donations;Workers Leaving the Lumière Factory
The Avenging Conscience;André Chénier;The Pearl Necklace;The Miracle;A Burlesque on Carmen;Discontent;The Ocean Waif;A Modern Knight;The Haunted Castle;The Flying Torpedo;A Grid-Iron Hero;A Nightmare;Uncle Tom's Cabin;Those Awful Hats;Lolita;Den sorte Domino;Zwei Menschen;Dík válečného sirotka;The Vampires or, The Arch Criminals of Paris
Edgar Allan Poe;The Seneschal's Diamond;Only Once a Year;The Voice of Passion;The Champion;When a Girl Loves;Cook & Rilly's Trained Rooster;Two Men of Sandy Bar;Dr. Jekyll and Mr. Hyde;Dr. Jekyll and Mr. Hyde;He Only Wanted to Play with Dodo;The One-Man Band;The Monster;The Electric Hotel;Il circolo nero;Kean;The Yellow Peril;Women’s Munition Work;Constantine
The Battle at Elderbush Gulch;Tih Minh;Cold Showers;His Lord's Will;Work;The Pursuit of Hate;Surprise Attack on a House at Daybreak;Her Indian Hero;After Death;The Airship Destroyer;Monsieur Clown Among the Lilliputians;Demolition of a Wall;What Happened on Twenty-Third Street, New York City;Rescued from an Eagle's Nest;The Golden Wedding;Poor Karin;Hate;Jeunes filles d'hier et d'aujourd'hui;Alice in Wonderland
Enoch Arden;The Secret of Forçat;The Alarm;The Sea Vultures;His New Job;The Flirt;L'utilité des rayons x;The Ransom of Red Chief;The Treasures of Satan;That Fatal Sneeze;Bébé's Masterpieces;Monkeyshines, No. 1;Gulliver's Travels Among the Lilliputians and the Giants;The Living Playing Cards;Jenny;For a Woman's Sake;The Most Beautiful Gift;Pour le pays;Fantasmagorie
The Massacre;Bébé fait du spiritisme;First Love;;In the Park;The Price;A House Divided;The Secret Man;Portrait;Die Arche. 2. Teil: Die letzten Menschen;The Persistent Salesman;Going to Bed Under Difficulties;The Enchanted Drawing;The Hilarious Posters;Robinet: Cyclist;Bokserparodi;Ein gefährliches Spiel;The Intrigue;The Cabbage-Patch Fairy
The Unchanging Sea;Les Etrennes de Bout-de-Zan;Zagadochnyy mir;;A Woman;The Merchant of Venice;Wonderful Absinthe;The Boss of the Rancho;The Devil and the Statue;The Tunnel;Krazy and Ignatz Discuss the Letter 'G';Dickson Experimental Sound Film;The Prince of Magicians;The Eclipse: Courtship of the Sun and Moon;Brutus;Kampen om Kvinden;The Unemployed Photographer;Les fiancés de 1914;The Adventurer
A Romance of Happy Valley;The Illustrious Madman;Wicked Night;;Caught in a Cabaret;Betty in Search of a Thrill;"Dranem Performs ""Five O'Clock Tea""";The Struggle;Faust and Mephistopheles;The End of the World;Policy and Pie;Blacksmith Scene;The Countryman and the Cinematograph;The Sealed Room;Il principe Zilah;Den lille Virtuos;The Plague in Florence;The Little Tin Soldiers;A Day's Pleasure
His Trust;Le Noël du poilu;Life in Death;;Shanghaied;It's No Laughing Matter;In the Year 2000;Knight of the Trail;Mortmain;Life Without Soul;Mary and Gretel;Man Walking Around a Corner;The Sick Kitten;The Red Spectre;Leone XIII;The Grass Widower;Klebolin Sticks to Everything;A Page of Glory;The Four Troublesome Heads
The Miser's Heart;The Defect;The Moon Beauty;;Police;A Heroine of '76;"Polin Performs ""The Anatomy of a Draftee""";The New Schoolmarm of Green River;The Plague in Florence;The Electric Girl;R.F.D. 10,000 B.C.;After the Ball;The Terrible Eruption of Mount Pelee and Destruction of St. Pierre, Martinique;The Capture of Roma;The Faun;The End of the World;A Romany Spy;Marraines de France;Gertie the Dinosaur
The Adventures of Dollie;Fantômas contre Fantômas;Her Heroic Feat;;Mabel's Married Life;The Spider and Her Web;A Sticky Woman;The Gun Woman;The Mysterious Retort;The End of the Homunculus;How Plimps and Plumps Fooled the Detective;Snowball Fight;Bluebeard;Edgar Allan Poe;Malombra;Money;Games of Youth;Belgian Campaigns in Africa;The Musketeers of Pig Alley
Enoch Arden;The Margrave's Daughter;Leon Drey;;A Night Out;A Cigarette - That's All;Serpentine Dance by Mme. Bob Walter;Hell Bent;Dr. Jekyll and Mr. Hyde;The Revenge of the Homunculus;Out of the Inkwell;The Photographical Congress Arrives in Lyon;Let Me Dream Again;The '?' Motorist;The Fire;Det gaadefulde Væsen;The Right To Exist;La reéducation professionnelle des mutilées de la guerre en France;The Vagabond
The Country Doctor;The Heart and the Money;Song of Triumphant Love;;Mabel's Strange Predicament;False Colors;The Tango;The Mystery of Lonely Gulch;The Love Tragedy of the Homunculus;Turn-of-the-Century Surgery;L'Homme Machine;Buffalo Running;The Living Playing Cards;The Palace of the Arabian Nights;By the Cross;Det blaa Blod;The Suffragette;Umanità;Kid Auto Races at Venice
The Burglar’s Dilemma;The Dwarf;Glory to Us, Death to the Enemy;;The Rounders;Eyes That See Not;Matrimony's Speed Limit;A Marked Man;The Ghost Breaker;The Inventor Crazybrains and His Wonderful Airship;The Lily of Belgium;Cordeliers' Square in Lyon;Eight Girls in a Barrel;New York Subway;Snowball Fight;Den mystiske selskabsdame;In Night and Ice;Michel and Viktoria;Behind the Screen
The School Teacher and the Waif;Tragic Error;The Happiness of Eternal Night;;The Count;Home;The Birth, the Life and the Death of Christ;The Navajo's Bride;The Doll's Revenge;The Artificial Man;Dreams of Toyland;A Terrible Night;Demolishing and Building Up the Star Theatre;"Princess Nicotine; or, The Smoke Fairy";Dante's Inferno;Hendes Helt;Das Gelübde der Keuschheit;Our Homeland's Trenches;Sallie Gardner at a Gallop
The Left-Handed Man;Molière;A Revolutionary;;The Bank;The Doctor and the Woman;Spain;The Fatal Card;Alraune;The Extraordinary Adventures of Saturnino Farandola;The War and the Dream of Momi;Accordion Player;Sherlock Holmes Baffled;Excursion to the Moon;Othello;En Søns Kærlighed;Vienna in War;Rentier Kulicke's Flug zur Front;Dante's Inferno
The Old Actor;A Four-Year-Old Heroine;Uncle's Apartment;;Between Showers;The Price of a Good Time;The Parish Priest's Christmas;Broncho Billy Puts One Over;How It Feels to Be Run Over;"The Twentieth Century Tramp; or, Happy Hooligan and His Airship";The Dull Sword;Bedtime for the Bride;The Infernal Cakewalk;The Adventures of Dollie;Love Everlasting;A Difficult Choice;Comic Encounter in the Djurgården;Hänschens Soldaten;Life of an American Fireman
A Flash of Light;The Legend of the Spinner;The King of Paris;;By the Sea;John Needham's Double;Playing Trumps;The Ranch Feud;Alraune, die Henkerstochter, genannt die rote Hanne;Onesime, Clockmaker;The Breath of a Nation;The Blacksmiths;Jack and the Beanstalk;The Country Doctor;Home, Sweet Home;John Takes Himself Off;Der Zeitungsriese;War As It Really Is;Frankenstein
Enoch Arden: Part II;Onesime, Clockmaker;Daydreams;;Dough and Dynamite;Jewel;At the Floral Ball;Trail to the West;Eerie Tales;A Trip to Jupiter;TR's Arrival in Africa;Monkeyshines, No. 2;History of a Crime;The Doctor's Secret;The Warrior;Manden med Arret;Lache Bajazzo;Nurse and Martyr;Poor Pierrot
The Son's Return;The Cleaning Man;;;The Knockout;For Husbands Only;The Irresistible Piano;Sophie's Sweetheart;The Haunted Curiosity Shop;La poupée: Le curé et les mannequins;The Pumpkin Race;Carmencita;The Coronation of King Peter I of Serbia;Wallachian Nomads;Satan;The Disturbed Sentry;Donna Lucia;Outposts of Empire;Easy Street
The Greatest Question;Jimmy Pulls The Trigger;;;The Masquerader;Mary Regan;The Dirigible 'Homeland';The Speed Maniac;Malombra;Police in the Year 2000;A.W.O.L.;Dickson Greeting;Tchin-Chao, the Chinese Conjurer;The Thieving Hand;Julius Caesar;The Virtuous One;Die Nacht des Grauens;Pershing's Crusaders;At the Dentist
Two Daughters of Eve;The Trust, or The Battles for Money;;;Tango Tangles;Hop - The Devil's Brew;The Cabbage-Patch Fairy;The Deserter;Faust and Marguerite;The Secret Room;Business Must Not Interfere;The Bewitched Inn;The Wonderful Living Fan;The Faithful Furniture;The Last Days of Pompeii;The Pride of the Circus;Lebenswogen;100% American;The Man with the Rubber Head
Two Memories;La vengeance du sergent de la ville;;;A Busy Day;The Mysterious Mrs. M;His Double;Chimmie Fadden Out West;Cleopatra's Tomb;Deadly Gas;Cartoons in the Hotel;The Sea;The Cook's Revenge;Tunneling the English Channel;Cab Number 13;King Frederik VIII's Arrival in Berlin;Gesprengte Ketten;;The Fireman
The Sacrifice;Bout-de-Zan and the Crocodile;;;Those Love Pangs;The Eye of God;How Monsieur Takes His Bath;The Red Glove;Fear;The Automatic Motorist;An Ace and a Joker;Playing Cards;The Gay Shoe Clerk;Marvelous Beehive;Carmen;The Morphine Takers;Alcohol;;Passage of Venus
The Call of the Wild;La Souris blanche;;;His Prehistoric Past;Wanted- A Home;Danse Fleur de Lotus;The Bandit King;In the Bogie Man's Cave;She;Feline Follies;The Kiss in the Tunnel;"Scrooge; or Marley's Ghost";The Golden Beetle;Maria di Magdala;En Død i Skønhed;How I Was Murdered;;Annabelle Serpentine Dance
Twin Brothers;Les deux gosses;;;A Film Johnnie;Sunshine Molly;An Untimely Intrusion;Branding Broadway;Dr. Jekyll and Mr. Hyde;Un viaggio in una stella;Animated Putty;The Fat and Lean Wrestling Match;Explosion of a Motor Car;The Son's Return;Grenadier Roland;Den hvide Dame;Mazeppa, der Volksheld der Ukraine;;The Student of Prague
Old Heidelberg;Mais n'te promène donc pas toute nue;;;His Musical Career;Lost by a Hair;Madame's Cravings;Past Redemption;The Spider and the Butterfly;Der Herr der Welt;Miniature Theatre;Edison Kinetoscopic Record of a Sneeze;How He Missed His Train;Long Distance Wireless Photography;Bink's Toreador;Thru Trials to Victory;Poor Jenny;;The Floorwalker
An Awful Moment;Severo Torelli;;;Recreation;From Death to Life;The Malagueña and the Bullfighter;Algie, the Miner;Satan at Play;Homunkulieschen;Charley on the Farm;The Merry Skeleton;Ball Passing Through a Soap Bubble;La flûte enchantée;If One Could See Into the Future;Temptations of a Great City;Opium;;Shoulder Arms
A Drunkard's Reformation;The Letters;;;Triple Trouble;The Picture of Dorian Gray;The O'Mers in 'The Bricklayers';Friends;Satan;Der Weltspiegel;A Duet;Autour d’une cabine;A Romance of the Rail;Two Memories;Juve contre Fantômas;Peace on Earth;The Love Tragedy of the Homunculus;;Baby's Meal
The Oath and the Man;In the Bushes;;;His New Profession;The Hand That Rocks the Cradle;"Félix Mayol Performs ""The Trottins' Polka""";'49–'17;The Man with Wax Faces;Lilith und Ly;He Never Objects to Noise;Newark Athlete;Uncle Josh at the Moving Picture Show;The Tired Tailor's Dream;Cretinetti re dei ladri;My Sister-in-Law from America;Die närrische Fabrik;;The Astronomer's Dream
Through Darkening Vales;The Open Eyes;;;Laughing Gas;A Midnight Romance;The Vampire;Wild and Woolly;The Queen of Spades;Marriage a la Carte;Bobby Bumps Starts a Lodge;Boat Leaving the Port;The Untameable Whiskers;A Funeral of a Metropolitan in Bitola;La ballata della strega;The Black Dream;Der Mädchenhirt;;Cinderella
The Battle;Esther;;;Twenty Minutes of Love;On the Brink;Frozen on Love's Trail;The Virginian;Hilde Warren and Death;Die Eisbraut;The Insects' Christmas;The Devil in a Convent;The Cook in Trouble;The Religious Holiday All Souls’ Day;Blue Blood;Paradise for the Lazy;Adamant's Last Race;;The Execution of Mary, Queen of Scots
Enoch Arden: Part I;Les millions de la bonne;;;Getting Acquainted;The Twins;The Fur Hat;The Man Without a Future;The Brand of Satan;Homunculus;Cat Trotting, Changing to a Gallop;The Boxing Cats;The Treasures of Satan;The Celebration of St. Cyril and Methodius on the Main Street in Bitola;Marc Antony and Cleopatra;Towards the Light;Das Opfer der Yella Rogesius;;The Haunted Castle
Home, Sweet Home;The New Mission of Judex;;;The New Janitor;A Japanese Idyll;Making an American Citizen;Scarlet Days;The Devil's Signature;The Intrigue;Matches: An Appeal;Serpentine Dance;The Enchanted Well;The Sacrifice;Pedestrian Love;Det gamle Købmandshjem;Um Krone und Peitsche;;The Conjurer
The House with Closed Shutters;For the Children;;;The Bond;How Men Propose;Alice Guy Films a 'Phonoscène' in the Studio at Buttes-Chaumont, Paris;The Spoilers;The Haunted Castle;De mystiske Z-Straaler;The Grasshopper and the Ant;Athlete Swinging a Pick;The Magic Lantern;Le matelas de la mariée;Carnevalesca;Mr. Fabian is Rathunting;Die Serpentintänzerin;;Making a Living
The Female of the Species;The Nativity;;;Caught in the Rain;;Greater Love Hath No Man;Nugget Jim's Pardner;Life Without Soul;Das lebende Rätsel;The Waiter's Dream;Fishing for Goldfish;The Devil and the Statue;Monsieur Clown Among the Lilliputians;Dall'amore al disonore;The Golden Horns;Arme Lena;;The Kiss
Love in an Apartment Hotel;The Fairy of the Surf;;;Gentlemen of Nerve;;The Lure;The Conqueror;La ballata della strega;William Voss;I'm Insured;The Pillar of Fire;Le village de Namo - Panorama pris d'une chaise à porteurs;The Call of the Wild;The Dread of Doom;A Lively Dream;Wanda's Trick;;20,000 Leagues Under the Sea
Betty of Greystone;Bébé Corrects His Father;;;Mabel's Busy Day;;The Dream Woman;The Mormon;The End of the Homunculus;Clash of the Titans;Never Again! The Story of a Speeder Cop.;Horse Trick Riders;Faust and Mephistopheles;MacNab's Visit to London;L'ira;The Strongest;Dresden, August-Brücke;;The Pawnshop
A Victim of Jealousy;Tih-Minh: Justice;;;His Trysting Places;;Turn-of-the-Century Surgery;Strongheart;The Revenge of the Homunculus;The Bodybuilder;The Chinese Shadows;Exit of Rip and the Dwarf;Panorama of Eiffel Tower;Come Cretinetti paga i debiti;The Legend of Saint Barbara;A Friend of the People;Der geprellte Don Juan;;Traffic Crossing Leeds Bridge
Jones and His New Neighbors;Tih-Minh: Document 29;;;The Property Man;;Danse Serpentine (In a Lion's Cage);His Only Son;The Dream Woman;Die große Wette;Cartoons On Tour;The X-Ray Fiend;The Pickpocket -- A Chase Through London;Telltale Reflections;Julian the Apostate;In the Hands of Imposters;Der Stier von Saldanha;;A Night in the Show
In the Aisles of the Wild;Tih-Minh: Wednesday, the 13th;;;His Favorite Pastime;;Disappearing Act;Under Burning Skies;A Cry in the Night;Pirates of 1920;Matsumoto Fragment;Annabelle Butterfly Dance;The Fairy of Spring;Fun After the Wedding;Pinocchio;Dr. Jekyll and Mr. Hyde;Elly und Nelly;;Sunnyside
A Rich Revenge;Tih-Min: The Saving Branch;;;A Jitney Elopement;;The Turn-of-the-Century Blind Man;The Patriot;Turn-of-the-Century Surgery;Die Entdeckung Deutschlands durch die Marsbewohner;"The Jealous Doll; or, The Frustrated Elopement";The Hallucinated Alchemist;Panoramic View of Boston Subway from an Electric Car;Sherlock Holmes in the Great Murder Mystery;The Last Days of Pompeii;Zigeuneren Raphael;Alraune and the Golem;;A Corner in Wheat
The Sunbeam;Tih-Minh: Beneath the Veil;;;The Face on the Barroom Floor;;Ocean Studies;The Cowboy Coward;The Mistletoe Bough;The Aerial Anarchists;Krazy Kat, Bugologist;Men Boxing;Steam Hammer;Twin Brothers;The Romance of a Jockey;A Human Life;Unsühnbar;;The Vanishing Lady
Friends;La cassette de l'émigrée;;;The Professor;;A Four-Year-Old Heroine;Told in Colorado;Maple Leaf Viewing;Grandfather's Pills;Lightning Sketches;Sandow;Départ de S. M. le Roi et de M. le Président pour la chasse à Rambouillet;Bébé's Masterpieces;The Merchant of Venice;Blind Justice;Carl und Carla;;Mabel at the Wheel
The Fall of Babylon;Tih-Minh: Evocation;;;Her Friend the Bandit;;Little Tich and His Funny Feet;Land O' Lizards;The Artificial Man;The Invisible Fluid;Captain Grogg's Wonderful Journey;Santa Claus;Nice : Sa Majesté Carnaval et le char des Limonadiers;An Awful Moment;The Extraordinary Adventures of Saturnino Farandola;The Will;Ringende Seelen;;A Burlesque on Carmen
A Trap for Santa Claus;Tih-Minh: Night Hawks;;;The Essanay-Chaplin Revue of 1916;;The Adventurer;The Good Bad Man;Andalusian Superstition;America to Europe in an Airship;The Little Soldier Who Became a God;Between Calais and Dover;The Fugitive Apparitions;A Drunkard's Reformation;La Moglie di Claudio;Sherlock Holmes;Gebannt und erlöst;;A Nightmare
The Usurer;Tih-Minh: At the Asylum;;;Charlie Chaplin Meets Harry Lauder;;The Cleaning Man;The Scrapper;The Knight of the Snow;The Mummy;Fancy Matches;The Little Girl and Her Cat;The Witch's Revenge;Klebolin Sticks to Everything;The Clemenceau Affair;Valdemars sejr;Der Seele Saiten schwingen nicht;;The Champion
The Violin Maker of Cremona;Tih-Minh: The Man in the Trunk;;;Chase Me Charlie;;Clown, Dog and Balloon;The Phantom Riders;Uncle Josh's Nightmare;Rescued in Mid-Air;Zim, Boum, Boum;Band Drill;The Mysterious Box;Les timidités de Rigadin;Nero and Agrippina;Trolovelsesringen;Kain;;Tillie's Punctured Romance
Scarlet Days;Tih-Minh: Mysteries of the Circe Villa;;;Charlie Butts In;;Le cireur distrait;The Soul Herder;The Damnation of Faust;Love and Science;Skeleton of Horse;Eight Girls in a Barrel;Neptune's Daughters;The Broken Violin;Hero and Leander;Nordisk Films Kompagnis studier;Die Zirkusgräfin;;Work
The Lesson;Tih-Minh: Two Dramatic Events During the Night;;;How to Make Movies;;The Drunken Mattress;The Making of Broncho Billy;Davey Jones' Locker;Auch Faulheit kann von Nutzen sein;Clown and His Dogs;The Magician;The Mystical Flame;The Express Sculptor;Tweedledum Wants to Be a Jockey;The Aviator's Generosity;Menschen;;The Wonderful Wizard of Oz
What Drink Did;Tih-Minh: The Potion of Forgetfulness;;;;;Dance of the Seasons: Winter, Snow Dance;The Gun Packer;The Mysteries of Myra;Ein neuer Erwerbszweig;The Sculptor's Nightmare;Souvenir Strip of the Edison Kinetoscope;Faust in the Underworld;The Village Blind Man;Il re, le torri e gli alfieri;De dumme Mandfolk;Marionetten des Teufels;;The Kingdom of the Fairies
Under Burning Skies;Le portrait de Mireille;;;;;The Coming of Sunbeam;The Fighting Brothers;Sleepy Hollow;Das andere Ich;Spanish Clair de Lune;Partie d'écarté;The Boys Think They Have One on Foxy Grandpa, But He Fools Them;Games of Youth;Champagne caprice;Gæstespillet;Sybill Morgan;;A Man There Was
A Timely Interception;S'affranchir - III - En garnison;;;;;Guillaume Tell;An Indian's Loyalty;The Missing Bride;The First Men in the Moon;Bobby Bumps' Amusement Park;The Haunted Castle;Terrible Teddy, the Grizzly King;A Mix-Up in the Gallery;Sunbeam;The Night Before Christian's Birthday;Die platonische Ehe;;His New Job
